LAFB-1||party of Ku Klux Klan Riders Gallop to our home in Omaha Nebraska
LAFB-2||the one night surrounding the house brandishing their shotguns and rifles they shouted for my father to come out
LAFB-3||my mother went to the front door and opened it standing where they could see her pregnant condition she told them that she was alone with her three small children and that my father was away preaching in Milwaukee
LAFB-5||my father the Reverend Earl little was a Baptist Minister a dedicated organizing for Marcus Aurelius garbes unia Universal negro Improvement Association
LAFB-6||with the help of such disciples as my father gobbi from his headquarters in New York City Harlem was Raising
LAFB-7||Banner of black race Purity and exhorting the Negro masses to return to their ancestral African Homeland a cause which it made Garvey the most controversial black man on Earth
LAFB-8||still shouting threats the klansman finally spurred their horses and galloped around the house shattering every window pane with their gun butts
LAFB-9||then they rode off into the night their torches flaring as suddenly as they had come
LAFB-10||my father was in Rage when he returned he decided to wait until I was born which would be soon and then the family would move
LAFB-11||I am not sure why he made this decision for he was not a frightened negro as most than were and many still are today
LAFB-12||my father was a big 6 ft for very black man
LAFB-13||he had only one eye how he lost the other one I have never known
LAFB-14||he was from Reynolds Georgia where he had left school after third or maybe fourth grade
LAFB-15||he believed as did Marcus Garvey the freedom Independence and self-respect could never be achieved by the Negro in America and that therefore the Negro should leave America to the white man and returned to his African land of origin
LAFB-16||among the reasons my father had decided to risk and dedicate his life to help disseminate this philosophy among his people
LAFB-17||was that he had seen four of his six brothers died by violence three of them killed by white men including one by lynching
LAFB-18||what my father could not know then was that of the remaining three including himself only one my Uncle Jim would die in bed of natural causes
LAFB-19||Northern white police were later to shoot my uncle Oscar and my father was finally himself to die by the white man's hands
LAFB-20||it is always been my belief that I too will die by violence I have done all that I can to be prepared
LAFB-21||I was my father's seventh child he had three children by a previous marriage Ella Earl and Mary who lived in Boston
LAFB-22||he had met and married my mother in Philadelphia where their first child my oldest full brother Wilfred was born
LAFB-23||they moved from Philadelphia to Omaha where Hilda and Filbert were born
LAFB-24||I was next in line my mother was 28 when I was born on May 19th 1925 in an Omaha Hospital
LAFB-25||then we move to Milwaukee where Reginald was born
LAFB-26||from infancy he had a kind of hernia condition which was to handicapped him physically for the rest of his life
LAFB-27||Louise little my mother was born in Grenada in the British West Indies look like a white woman
LAFB-28||her father was white she had straight black hair and her accent did not sound like a Negroes
LAFB-29||of this white father of hers I know nothing except her Shame about it
LAFB-30||I remember hearing her say she was glad that she had
LAFB-31||Racine him it wasn't course because of him I got my reddish-brown marigny color of skin and my hair the same color
LAFB-32||I was the lightest child in our family out in the world later on in Boston and New York I was among the millions of negroes who were insane enough to feel that it was some kind of status symbol to be like complexion the one that wasn't actually fortunate to be born this
LAFB-33||but still later I learned to hate every drop of that white rapist blood that is in me
LAFB-34||our family stayed only briefly in Milwaukee for my father wanted to find a place where he can raise our own food and crab to build a business
LAFB-35||the teaching of Marcus Garvey stress becoming independent of the white man
LAFB-36||we went next for some reason to Lansing Michigan
LAFB-37||my father bought a house and soon as have been his pattern he was doing freelance Christian preaching in local negro Baptist churches and during the week he was roaming about spreading word of Marcus Garvey
LAFB-38||it began to Layaway savings for the store he had always wanted to own when as always some stupid local Uncle Tom Negroes began to funnel stories about his revolutionary beliefs to the local white people
LAFB-39||this time to get out of town threats came from a local hate society called the black Legion
LAFB-40||they wore black robes instead of white soon nearly everywhere my father went black Legion ears were revealing him is an uppity Niger for wanting to own a store for living outside the Lansing negro district for spreading unrest and dissension among the good niggars
LAFB-41||as an Omaha my mother was pregnant again this time with my youngest sister
LAFB-42||shortly after Yvonne was born came the Nightmare Night in 1929 my earliest vivid memory
LAFB-43||I remember being suddenly snatched awakened to a frightening confusion of pistol shots and shouting and smoke and Flames my father had shouted and Shaw
LAFB-44||at the two white men who had set the fire and we're running away
LAFB-45||our home was burning down around us we were lunging and bumping and tumbling all over each other trying to escape
LAFB-46||my mother with the baby in her arms just made it into the yard before the house crashed in showering Sparks
LAFB-47||I remember we were outside in the night in our underwear crying and yelling our heads off the white police and fireman came and stood around us watching as the house burned to the ground
LAFB-48||my father prevailed on some friends to close and houses temporarily
LAFB-49||then he moved us into another house on the outskirts of East Lansing
LAFB-50||in those days Negroes weren't allowed after dark in East Lansing proper
LAFB-51||that's where Michigan State University is located
LAFB-52||I related all of this to an audience of students when I spoke there in January 1963 and had the first reunions in a long time with my younger
LAFB-53||the Robert who was there doing postgraduate studies in psychology
LAFB-54||I told them how East Lansing harassed us so much that we had to move again this time to miles out of town into the country
LAFB-55||this is where my father built for us with his own hands a four-room house
LAFB-56||this is where I really begin to remember things this home where I started to grow up
LAFB-58||the pistol they were looking for which they never found and for which they wouldn't issue a permit with sewed up inside a pillow
LAFB-59||my father's 22 rifle and a shotgun though were right out in the open everyone had them for hunting birds and rabbits and other game
LAFB-60||after that my memories are of the friction between my father and mother
LAFB-61||they seem to be nearly always at odds sometimes my father would beat her
LAFB-62||it might have had something to do with the fact that my mother had a pretty good education
LAFB-63||where she got it I don't know but an educated woman I suppose can't resist the temptation to correct an uneducated man
LAFB-64||every now and then when she put those smooth words on him he would grab her
LAFB-65||my father was also belligerent toward all of the children except me
LAFB-66||the older ones he would be almost savagely if they broke any of his rules and he had so many rules it was hard to know them all
LAFB-67||nearly all my whippings came from my mother I thought a lot about why
LAFB-68||I actually believe that is anti-white as my father was he was subconsciously so Afflicted with the white man's brainwashing of negroes that he inclined to favor the light ones and I was his lightest job
LAFB-69||most negro parents in those days would almost instinctively treat any lighter children better than they did the darker ones
LAFB-70||it came directly from the slavery tradition that the mulatto because he was visibly nearer to White was there for better
LAFB-71||my two other images of my father were both outside the home one was his role as a Baptist preacher
LAFB-72||he never Pastor than any regular church of his own he was always a visiting preacher
LAFB-73||I remember especially his favorite sermon
LAFB-74||that little black train is a coming and you better get all your business right
LAFB-75||I guess this also fit his association with the back to Africa movement with Marcus garvey's Black Train Homewood
LAFB-76||my brother filbert the one just older than me love to church but it confused and amazed me I would sit goggle-eyed at my father jumping and shouting as he preached with the congregation jumping and shouting behind him this souls and bye
LAFB-78||I had very little respect for most people who represented religion
LAFB-79||it was in his role as a preacher that my father had most contact with the Negroes of Lansing believe me when I tell you that those Negroes were in bad shape then they are still in bad shape though in a different way
LAFB-80||by that I mean I don't know what town do the higher percentage of complacent misguided so-called middle-class Negroes the typical status symbol oriented integration seeking type negro
LAFB-81||just recently I was standing in the lobby at the United Nations talkin with an African Ambassador and his wife when a negro came up to me and said you know me
LAFB-82||I was a little embarrassed because I thought he was someone else
LAFB-84||back when I was growing up the successful lanzini grows with such as waiters and bootblacks
LAFB-85||to be a janitor at some downtown store was to be highly respected
LAFB-86||the real elite the big shots the voices of the race with the waiters at the Lansing Country Club and the shoeshine boys at the state capitol
LAFB-87||the only Negroes really had any money with the ones in the numbers record or who ran the gambling houses or who in some other way live parasitically off the poorest ones who were the masses
LAFB-88||no Negroes were hired then by Landings big Oldsmobile plant or the real plant do you remember the Rio it was
LAFB-89||Orchard in Lansing and re old the man after whom it was named also lived in Lansing when the war came along they hired some negro janitors
LAFB-90||the bulk of the Negroes were either on welfare or WPA or they starved
LAFB-91||the day was to come when our family was so poor that we would eat the whole out of a donut
LAFB-92||but at that time we will much better off than most Town Negroes
LAFB-93||the reason was that we raised much of our own food out there in the country where we were
LAFB-94||we were much better off than the town Negroes who would shout as my father preached for the pie-in-the-sky and their heaven in the Hereafter while the white man had his here on Earth
LAFB-95||I knew that the collections my father God for his preaching were mainly what fed enclosed us and he also did other odd jobs but still the image of him that made me proudest was his crusading and Millington
LAFB-96||campaigning with the words of Marcus Garvey
LAFB-97||as young as I was then I knew from what I overheard that my father was saying something that made him a tough man
LAFB-98||I remember an old lady grinning and saying to my father you're scaring these white folks to death
LAFB-99||one of the reasons I've always felt that my father favored me was that to the best of my remembrance
LAFB-100||it was only me that he sometimes took with him to the Garvey unia meetings which he held quietly in different people's homes
LAFB-101||there were never more than a few people at any one time 20 at most but that was a lot packed into someone's living room
LAFB-102||I noticed how differently they all acted although sometimes they were the same people who jumped and shouted in church
LAFB-103||but in these meetings both day and my father were more intense more intelligent and down-to-earth it made me feel the same way
LAFB-104||I can remember hearing of Adam driven out of the go
LAFB-105||into the caves of Europe Africa for the Africans Ethiopians awake
LAFB-107||I remember seeing the Big Shiny photographs of Marcus Garvey that were passed from hand to hand
LAFB-108||my father had a big envelope of them that he always took to these meetings
LAFB-109||the picture showed what seemed to me millions of negroes thronged in parade behind Garvey riding in a fine car a big black man dressed in a dazzling uniform with gold braid on it
LAFB-110||and he was wearing a thrilling hat with tall plumes
LAFB-111||I remember hearing that he had black follow was not only in the
LAFB-112||nited States but all around the world and I remember how the meetings always closed with my father saying several times and the people chatting after him up you might he race you can accomplish what you will
LAFB-113||I've never understood why after hearing is much as I did at these kinds of things I somehow never thought then of the black people in Africa
LAFB-114||my image of Africa at that time was of naked Savages cannibals monkeys and tigers and steaming jungles
LAFB-115||my father would drive his old black touring car sometimes taking me to meeting places all around the Lansing area
LAFB-116||I remember one daytime meeting most were at night in the town of Owosso 40 miles from Lansing which the Negroes called White City
LAFB-117||Owasso greatest claim to fame is that it is the hometown of Thomas E Dewey
LAFB-118||as in East Lansing no Negroes were allowed on the streets there after doc hence
LAFB-120||Mister lion to be the famous football star at Mason High School and was highly thought of in Mason and consequently he now worked around that town in menial jobs
LAFB-121||my mother at this time seem to be always working cooking washing ironing cleaning and fussing over us eight children and she was usually either arguing with or not speaking to my father
LAFB-123||I've said that my mother was the one who whipped me at least she did whenever she wasn't ashamed to let the neighbors think she was killing me
LAFB-124||but even if she acted as though she was about to raise her hand to me I would open my mouth and let the world know about
LAFB-125||if anybody was passing by out on the road she would either change your mind or just give me a few licks
LAFB-126||thinking about it now I feel definitely that just as my father favored me for being lighter than the other children my mother gave me more hell for the same reason
LAFB-127||she was very light herself but she favored the ones who would darker Wilfred I know was particularly her angel
LAFB-128||I remember that she would tell me to get out of the house and let the sun shine on you so you can get some color
LAFB-129||she went out of her way to never let me become Afflicted with a sense of color superiority
LAFB-130||I am sure that you treated me this way partly because of how she came to be light herself
LAFB-131||I learned early the crying out in protest could accomplish things
LAFB-132||my older brothers and sisters had started to school when sometimes they would come in and ask for a Buttered Biscuit of something in my mother and patiently would tell them no
LAFB-133||but I would cry out and make a fuss until I got what I want
LAFB-135||not only did we have our big Garden but we raised chickens
LAFB-136||my father would buy some baby chicks and my mother would raise them
LAFB-137||we all loved chicken that was one dish there was no argument with my father about
LAFB-138||one thing in particular that I remember made me feel grateful toward my mother was at one day I went and asked her for my own garden and she did let me have my own there
LAFB-139||W I loved it and took care of it well
LAFB-141||at 5 I to began to go to school
LAFB-142||leaving home in the morning along with Wilfred Hilda and Filbert
LAFB-143||it was the Pleasant Grove School that went from kindergarten through 8th grade
LAFB-144||it was two miles outside the city limits and I guess there was no problem about our attending because we were the only Negroes in the area
LAFB-145||in those days white people in the north usually would adopt just a few Negroes they didn't see them as any threat
LAFB-146||the white kid didn't make any great thing about it's either they called us.
LAFB-147||daki and rastas so much that we thought those were unnatural names but they didn't think of it as an insult it was just the way they thought about us
LAFB-148||one afternoon in 1931 when Wilfred Hilda filbert not came home
LAFB-149||my mother and father were having one of their arguments they had been lately a lot of tension around the house because of black Legion threats anyway my father had taken one of the rabbits which we were raising and ordered my mother to cook it
LAFB-150||we raised rabbits but sold them to whites
LAFB-151||my father had taken a rabbit from the rabbit pin he had pulled off the rabbit's head he was so strong he needed no knife to behead chickens are rabbits with one Twist of his big black hands is simply Twisted off the head and through the bleeding naked thing back at my mother's feet
LAFB-152||my mother was crying she started to skin the rabbit Preparatory to cooking it
LAFB-153||but my father was so angry he slammed on out of the front door and started walking up the road towards
LAFB-154||it was then that my mother had this vision
LAFB-155||she's always been a strange woman in this sense and it always had a strong intuition two things about to happen and most of our children with the same way I think
LAFB-156||what something is about to happen I can feel something sent something
LAFB-157||I've never known something to happen that is caught me completely off-guard except once
LAFB-158||and that was when years later I discovered facts I couldn't believe about a man who up until that discovery
LAFB-159||I would gladly have given my life for my father was well up the road with my mother and screaming out onto the porch
LAFB-160||pre plucked up an apron in one hand and ran down across the yard and into the road
LAFB-161||my father turned around he saw her for some reason considering how angry he had been when he left he waved at her
LAFB-162||but he kept on going she told me later my mother did that she had a vision of my father's end
LAFB-163||all the rest of the afternoon she was not herself
LAFB-164||crying and nervous and upset she finished cooking the rabbit and put the whole thing in the warmer pot of the black stove
LAFB-165||when my father was not back home by our bedtime
LAFB-166||my mother hug and clutched us and we felt strange not knowing what to do because she had never acted like that
LAFB-167||I remember waking up to the sound of my mother screaming again
LAFB-168||when I scrambled out I saw the police in the living room they were trying to calm her down she had snatched on her clothes to go with them and all of us children who were staring new without anyone having to say it that something terrible that happened to our father
LAFB-169||my mother was taken by the police to the hospital into a room where is sheet was over my father in the bed and she wouldn't look she was afraid to look
LAFB-170||probably it was wise but she didn't my father's skull on one side was crushed and I was told later
LAFB-171||Negroes in Lansing of always whispered that he was attacked and then laid across some tracks for A Streetcar to run
LAFB-172||over his body was cut almost in half
LAFB-173||he live two and a half hours in that condition
LAFB-174||Negroes Den was stronger than they are now specially Georgia Negroes
LAFB-175||Negroes born in Georgia had to be strong simply to survive
LAFB-176||it was morning when we children at home got the word that he was dead
LAFB-177||I was six I can remember a vague commotion the house filled up with people crying saying bitterly that the white black Legion had finally gotten him
LAFB-178||my mother was hysterical in the bedroom when will holding smelling salts under her nose she was still hysterical at the funeral
LAFB-179||I don't have a very clear memory of the funeral either
LAFB-180||oddly the main thing I remember is that it wasn't in a church and that surprised me since my father was a preacher and I had been where he preached people's funerals in churches but his was in a funeral home
LAFB-181||and I remember the during the service a big black fly came down and land
LAFB-182||my father's face and Wilfred spring up from his charity shooed the fly away and he came groping back to his chair they were folding chairs for us to sit on and the tears were streaming down his face
LAFB-183||when we went by the casket I remember that I thought it looked as if my father's strong blackface have been dusted with flour and I wish they hadn't put on such a lot of it
LAFB-184||back in the big four-room house they were many visitors for another week or so
LAFB-185||they were good friends of the family such as the lions from Mason 12 miles away in the Walkers mcgwire's list goes the greens Randolph and the Turners and others from Lansing and a lot of people from other towns who might seen at the Garvey meetings
LAFB-186||we children adjusted more easily than our mother did
LAFB-187||we couldn't see as clearly as she did the trials that lay ahead
LAFB-188||as the visitors tapered off she became very concerned about collecting the to ensure
LAFB-189||policies that my father had always been proud he carried he had always said that family should be protected in case of death
LAFB-190||one policy apparently paid off without any problem the smaller one I don't know the amount of it I would have imagined it was not more than $1,000 and maybe half of that
LAFB-191||but after that money came in my mother had paid out a lot of it for the funeral and expenses she began going into town and returning very upset
LAFB-192||the company that issued the biggest policy was balking at paying off they were claiming that my father had committed suicide
LAFB-193||visitors came again and it was bitter talked about white people
LAFB-194||How Could my father Bears himself in the head then get down across the street car tracks to be run over
LAFB-195||so there we were my mother was 34 years old now with no husband no provider or protector
LAFB-196||take care of her eight children but some kind of family routine got going again and for as long as the first insurance money lasted we did all right
LAFB-197||Wilfred who was a pretty stable fellow began to act older than his age
LAFB-198||I think he had the sense to see when the rest of us didn't what was in the wind for us
LAFB-199||he quietly quit school and went to town in search of work
LAFB-200||he took any kind of job you could find and he would come home dog tired in the evenings and give whatever he had made to my mother
LAFB-201||Hilda who had been quiet too attended to the babies
LAFB-202||Gilbert and I didn't contribute anything we fought all the time each other at home and then it's cool we would team up and fight white kid sometimes the fights would be racial in nature but they might be about anyting
LAFB-203||Reginald came under my wing since he had grown out of the toppling stage he and I had to come very close
LAFB-204||I suppose I enjoyed the fact that he was the little one under me who looked up to me
LAFB-205||my mother began to buy on credit my father had always been very strongly against credit
LAFB-206||credit is the first step into debt and back into slavery he it always said
LAFB-207||and then she went to work herself she would going to Lansing to find different jobs in housework or sewing for white people
LAFB-208||they didn't realize usually that she was a negro a lot of white people around there didn't mark Negroes in that houses
LAFB-209||she would do fine until someway or eyelid got two people who she was whose widowed she was and then she would be let go
LAFB-210||I remember how she used to come home crying but trying to hide it because she had lost the job that she needed so much
LAFB-211||once when one of us I cannot remember which had to go for something to where she was working and the people Sauced and realize she was actually a negro she was fired on the spot
LAFB-212||and she came home I'm crying this time not hiding it
LAFB-213||when the state welfare people began coming to our house we would come from school sometimes and find them talkin with our mother asking a thousand questions
LAFB-214||they acted in look at her and that us and around in our house and awake that had about it the feeling at least for me that we will not people in their eyesight we were just things that was all
LAFB-216||we began to go swiftly downhill the physical downhill wasn't as quick as the psychological my mother was above everything else a proud woman and it took
LAFB-217||toll on her that she was accepting charity and her feelings will communicated to us
LAFB-219||but the monthly welfare check was there pass
LAFB-220||they acted as if they owned us as if we were their private property as much as my mother would have liked to she couldn't keep them out
LAFB-221||she would get particularly incensed when they began insisting upon drawing us older children aside one at a time out on the porch or somewhere and asking us questions or telling us things against our mother and against each other
LAFB-222||we couldn't understand why if the state was willing to give us packages of meat sacks
LAFB-223||bagels and fruit and cans of all kinds of things I will mother obviously hate it too except we really couldn't understand
LAFB-224||what I later understood was that my mother was making a desperate effort to preserve her pride and hours
