LAFB-1817||Reginald and I wear the next two in line and Yvonne Wesley and Robert were still in Lansing in school
LAFB-1818||Reginald and I laughed about filbert who the last time I had seen him had gotten deeply religious he wore one of those round straw hats
LAFB-1819||Reginald ship was in for about a week getting some kind of repairs on its engines
LAFB-1820||I was pleased to see that Reginald oh he said little about it at mired my living by my wits
LAFB-1821||Reginald rest a little too loudly I thought I got a reefer customer of mine to get him a more conservative overcoat and suit
LAFB-1822||I told Reginald what I had learned that in order to get something you had to look as though you already had something
LAFB-1823||before Reginald left ironed him to leave the Merchant Marine and I would help him get started in Harlem
LAFB-1824||I must have felt that having my kid brother around me would be a good thing then there would be 2 people I could trust
LAFB-1825||Sammy was the other Reginald was cool at his age I would have been willing to run behind the train to get to New York at the Harlem but Reginald said when he left
LAFB-1826||I'll think about it not long after resin
LAFB-1827||left I dragged out the wildest zoot suit in New York this was 1943
LAFB-1828||the Boston draft board had written me at Ellis and when they had no result there had notified the New York draft board and in care of Sammy I received Uncle Sam greetings
LAFB-1829||in those days only three things in the world scared me jail a job and the army
LAFB-1830||I had about 10 days before I was to show up at the end unction Center I went right to work
LAFB-1831||the Army intelligence soldiers those black spies in civilian clothes hung around in Harlem with their ears open for the white man downtown I knew exactly where to start dropping the word I started noising around that I was frantic to join
LAFB-1832||the Japanese Army when I sent that I have the ears of the spies I would talk and ask hide crazy
LAFB-1833||a lot of the Harlem Hustlers actually had reach that state as I would later
LAFB-1834||it was inevitable when one had gone long enough on heavier and heavier narcotics and under the steadily tightening Vice of the hustling life
LAFB-1835||I'd snatch out read my greetings allowed to make certainly at her who I was and when I'd report downtown
LAFB-1836||this was probably the only time I real name was ever heard in Harlem in those days
LAFB-1837||the day I went down there I costumes like an actor with my wild zoot suit I wore the yellow knob toe shoes and I frizzled my hair up into a reddish bushel skunk
LAFB-1839||they had their wire on me from Uptown all right but they still
LAFB-1841||most of them were white of course the tender looking ones appeared ready to run from me some others had that vinegary worst kind of Niger look and a few were amused seeing me is the Harlem jigaboo archetype
LAFB-1842||also amused with some of the rooms 10 or 12 Negroes but the stony-faced rest of them looked as if they were ready to sign up to go off killing somebody they would have liked to start with me
LAFB-1843||the line moved the law pretty soon strip to my shorts I was making my eager to join comments in the medical examination rooms and everybody in the white coats that I saw
LAFB-1844||had 4f in his eyes I stayed in the line longer than I expected before they siphoned be off
LAFB-1845||one of the white coats accompanied me around the Turning hallway
LAFB-1846||I knew we were on the way to a headshrinker the Army psychiatrist
LAFB-1847||the receptionist there was a negro nurse I remember she was in her early twenties and not bad to look at
LAFB-1849||you couldn't read the Negro press for the big pictures of Smaug black firsts
LAFB-1850||somebody was inside with the psychiatrist I didn't even have to put on any act for this black girl she was already sick of me
LAFB-1851||when finally abuzz came at her desk she didn't send me she went in
LAFB-1852||I knew what she was doing she was going to make clear in advance what she thought of me
LAFB-1853||this is still one of the black man's big troubles today
LAFB-1854||so many of these so-called upper-class Negroes are so busy trying to impress on the white man that they are different from those others that they can't see they are only helping the white man to keep his low opinion of all Negroes
LAFB-1855||and then with her prestige in the clear she came out and nodded to me to go in
LAFB-1856||I must say this for that psychiatrist he tried to be objective and professional in his manner
LAFB-1857||he sat there and doodled with his blue pencil on a tablet listening to me Speidel to him for three or four minutes before he got to word in
LAFB-1858||his tack was quiet questions to get it why I was so anxious I didn't rush
LAFB-1859||I circled in hedge watching him closely to let him think he was pulling what he wanted out of me
LAFB-1860||I kept jerking around backward as though somebody might be listening
LAFB-1861||I knew I was going to send him back to the books to figure out what kind of case I was
LAFB-1862||suddenly I sprang up and peeped under both doors the one-eyed entered and another that probably was a closet and then I bent them whispered fast in his ear
LAFB-1863||Daddy-o now you and me we're from up North here so don't you tell nobody I want to get sent down south organized them niggars soldiers you did steal us some guns and kill us some crackers
LAFB-1864||that psychiatrist blue pencil dropped and his professional manner fell off and all directions
LAFB-1865||he stared at me as if I were a snake's egg hatching fumbling for his red pencil I knew I had him
LAFB-1866||I was going back out past Miss first when he said that will be all
LAFB-1867||a 4-f card came to me in the mail and I never heard from the Army anymore and never bothered to ask why I was rejected
LAFB-1869||negro railroad men waited for their trains in their big locker room on the lower level of Grand Central Station
LAFB-1870||big Blackjack and poker games went on in there around the clock
LAFB-1871||sometimes $500 would be on the table
LAFB-1872||one day in a blackjack game and old cook who was dealing the cards tried to be slick and I had to drop my pistol in his face
LAFB-1873||the next time I went into one of those games intuition told me to stick my gun under my belt right down the middle of my back
LAFB-1874||sure enough someone it squealed
LAFB-1875||two big beefy faced Irish cop came in
LAFB-1876||they frisked me and they missed my gun where they hadn't expected
LAFB-1877||the cops told me never again to be caught in Grand Central Station unless I had a ticket to ride somewhere
LAFB-1878||and I knew that by the next day every railroads personnel office would have a black ball on me so I never tried to get another railroad job
LAFB-1879||there I was back in Harlem streets among all the rest of the hustlers I couldn't sell reefers the dope Squad detectives were too familiar with me I was a true Hustler uneducated unskilled at anyting honorable and I considered myself nervy
LAFB-1880||and cunning enough to live by my wits exploiting any prey that presented itself I would risk just about anything
LAFB-1881||right now in every Big City ghetto tens of thousands of yesterday's and today's school dropouts are keeping Body and Soul together by some form of hustling in the same way I did
LAFB-1882||and they inevitably move into more and more worse and worse illegality and immorality
LAFB-1883||full-time Hustlers never can relax to appraise what they are doing and where they are bound
LAFB-1885||during the next six to eight months I pulled my first robberies and stick ups only small ones always in other nearby cities and I got a way
LAFB-1886||as the pros did I too would keep myself to pull these jobs by my first use of harddope I began with Sammy's recommendations sniffing cocaine
LAFB-1887||normally now for Street where I might call it I carried a hardly noticeable little flat blue steel 25 automatic but for working
LAFB-1888||I carried a 32 or 38 or 45
LAFB-1889||I saw how when the eyes stared at the big black hole the faces fell slacking the mouth sagged open and when I spoke the people seem to hear as though they were far away and they would do whatever I ask
LAFB-1890||between jobs staying high on narcotics kept me from getting nervous still upon sudden impulses just to play safe
LAFB-1891||I would have broccoli move from one to another 15 to $20 a week room always in my favorite one
LAFB-1892||hundred 47th 150th Street area just flanking Sugar Hill
LAFB-1893||once on a job with Sammy we had a pretty close call someone must have seen us we were making our getaway running when we heard the siren instantly we slowed to walking
LAFB-1894||as a police car screeched to a stop we stepped out into the street meeting it hailing it to ask for directions
LAFB-1895||they must have thought we were about to give them some information they just cursed us and raced on again it didn't cross the white men's Minds that a trick like that might be pulled on them by Negroes
LAFB-1896||the suits that I wore the finest I bought hot for about 35 to $50
LAFB-1897||I made it my rule never to go after more than I needed to live on
LAFB-1898||any experienced Housley will tell you that getting greedy is the quickest road to prison
LAFB-1899||I kept taste in my head vulnerable places and situations and I would perform the next job
LAFB-1900||only when my bankroll in my pocket began to get too low
LAFB-1901||some weeks I bet large amounts on the numbers
LAFB-1902||I still played with the same Runner with whom I'd started and Smalls Paradise
LAFB-1903||laying my hunches many a day I'd have up to $40 on two numbers hoping for that fabulous 602 one payoff
LAFB-1904||but I never did hit a big number full board
LAFB-1905||there's no telling what I might have done if I'd landed $10,000 or $12,000 at one time
LAFB-1906||of course once in awhile I hit a small combination figure
LAFB-1907||sometimes flush like that I'd telephone Sophia to come over from Boston for a couple of days
LAFB-1908||I went to the movies a lot again and I never miss my musician friends whenever they were playing either in Harlem downtown at the big theaters or on 52nd Street
LAFB-1909||Reginald and I got very close the next time his ship came back into New York
LAFB-1910||we discussed our family and what is she
LAFB-1911||it was that our book-loving oldest brother Wilfred had never had the chance to go to some of those big universities where he would have gone far
LAFB-1912||and we exchanged thought we had never shared with anyone
LAFB-1913||Reginald in his quiet way was a mad fan of musicians and music
LAFB-1914||when his ship sailed one morning without him a principal reason was that I had thoroughly exposed him to the exciting musical world
LAFB-1915||we had wild X backstage with the musicians when they were playing the Roxy or the Paramount
LAFB-1916||after selling reefers with the bands as they travel I was known to almost every popular Negro musician around New York in 1944 or 1945
LAFB-1917||Reginald and I went to the Savoy Ballroom the Apollo Theater the Braddock Hotel bar the night clubs and speakeasies wherever Negroes played music
LAFB-1918||the great lady day Billie Holiday hugged him and called him baby brother
LAFB-1919||Reginald shared tens of thousands of negroes feelings that The Living End of the big bands was Lionel Hampton
LAFB-1920||I was very close to many of the men and a band I introduced Reginald to them and also to Hampton self and hats wife and business manager Gladys Hampton
LAFB-1921||one of this world's sweetest people is Hamp
LAFB-1922||anyone who knows him will tell you that he'd often do the most generous things or people he barely knew
LAFB-1923||as much money as happy as made and still makes he would be broke today if his money in his business weren't handled by Gladys who is one of the brainiest women I ever met
LAFB-1924||the Apollo Theater Zona Frank shipment could tell you
LAFB-1925||he generally signed bands to play for a set weekly amount but I know that once during those days Gladys Hampton instead of range the deal for hams band to play for a cut of the gate
LAFB-1926||then the usual number of shows was doubled up if I'm not mistaken eight shows a day instead of the usual 4 and hams pulling power cleaned up
LAFB-1927||Gladys Hampton used to talk to me a lot and she tried to give me good advice come down
LAFB-1928||Gladys saw how Wild I was she saw me headed daughter bad end
LAFB-1929||one of the things I liked about Reginald was that when I left him to go away working Reginald to ask me no questions
LAFB-1930||after he came to Harlem I went on more jobs than usual
LAFB-1931||I guess that one influence me to get my first actual apartment with my not wanting Reginald to be knocking around Harlem without anywhere to call home
LAFB-1933||with the apartment as our headquarters I gradually got Reginald introduced around to Creole bills and other Harlem after hours spots
LAFB-1934||about 2 every morning as the downtown white night clubs closed Reginald and I would stand around in front of this or that Harlem after-hours place and I've School into what was happening
LAFB-1935||especially after the night clubs downtown closed the taxis in Black limousines would be driving Uptown bringing those white people who never could get enough of negro soul
LAFB-1937||inside every after-hours spot the smoke would hurt your eyes for white people to every negro would be in their drinking whiskey from coffee cups and eating fried chicken
LAFB-1938||the generally flushed face white men in their makeup mask glitter
LAFB-1939||God women will be pounding each other's backs and uproariously laughing and applauding the music
LAFB-1940||a lot of the wife's drunk would go staggering up to Negroes the waiters the owners or Negroes at tables wringing their hands even trying to hug them you're just as good as I am I want you to know that
LAFB-1941||the most famous places Drew both negro and white celebrities who enjoyed each other
LAFB-1942||a jam-packed 4:30 a.m. crowd at Jimmy's Chicken Shack or Dickie Wells might have such a jam session entertainment is Hazel Scott playing the piano for Billie Holiday singing the blues
LAFB-1943||Jimmy's Chicken Shack incidentally was where once later on I worked briefly as a waiter
LAFB-1944||that's where Red Fox was the dishwasher who kept the kitchen crew in stitches
LAFB-1945||after a while my brother Reginald had to have a Hustle
LAFB-1946||and I gave much thought to what would be for him a good safe Hustle
LAFB-1947||after he'd learned his own way around it would be up to him to take risks for himself
LAFB-1948||if you wanted to make more inquicker money the hustle I got Reginald into
LAFB-1949||really was very simple it utilize the psychology of the ghetto jungle
LAFB-1950||downtown he paid the $2 or whatever it was for a regular City Peddler's license
LAFB-1951||then I took him to a manufacturer's Outlet where we bought our supply of cheap imperfect s shirts underwear cheap rings watches all kinds of quick sale items
LAFB-1952||watching me work this awful back in Harlem Reginald's quickly caught on how to go into barber shops Beauty parlors and bars acting very nervous as he let the customers peep into his small valise of loot
LAFB-1953||with so many things around anxious to get rid of stolen good quality merchandise cheaply many Harlem I purely because of this conditioning jumped to pay hot
LAFB-1954||prices for inferior good to sail was perfectly legitimate
LAFB-1955||it never took long to get rid of a valise fo4 at least twice what it is cost and if any cop stop Reginald he had in his pocket both the Peddler's license and the manufacturers Outlet bills of sale
LAFB-1956||Reginald only had to be certain that none of the customers to whom he sold ever saw that he was legitimate
LAFB-1957||I assumed that Reginald like most of the Negroes I knew would go for a white one
LAFB-1958||I point out negro happy white women to him and explain that a negro with any brains could wrap these women around his fingers
LAFB-1959||but I have to say this for Reginald he never liked white women
LAFB-1960||I remember the one time he met Sophia he was so cool it upset Sophia and it tickled me
LAFB-1961||Reginald got himself a black woman I guess you was pushing through
LAFB-1962||and Old Settlers as we called them back in those days
LAFB-1963||she was a waitress and an exclusive restaurant downtown
LAFB-1964||she lavished on Reginald everything she had
LAFB-1965||she was so happy to get a young man I mean she bought him clothes cooked and wash for him and everything as though he were a baby
LAFB-1966||that was just another example of why my respect for my younger brother kept increasing
LAFB-1967||Reginald showed in often surprising way more sense than a lot of working Hustler twice his age
LAFB-1968||Reginald n was only 16 but a six footer he looked and acted much older than his years
LAFB-1969||all through the war of the Harlem racial picture never was too bright
LAFB-1970||tension built to a pretty high-pitch Old-Timers told me that Harlem had never been the same since the 1935 Riot when millions of dollars worth of damage was done by thousands of negroes
LAFB-1971||furiated chiefly by the white merchants in Harlem refusing to hire a negro even as Ben stores raped in Harlem's money
LAFB-1972||during World War II Marilyn Guardia officially close the Savoy Ballroom
LAFB-1973||Harlem said the real reason was to stop Negroes from dancing with white women Harlem said that no one dragged the white women in there
LAFB-1975||City Hall kept the Savoy closed for a long time
LAFB-1976||it was just another one of those liberal North actions that didn't help Harlem to love the white man any
LAFB-1977||finally rumor flashed that in the Braddock Hotel
LAFB-1978||white cops had shot a Negro Soldier
LAFB-1979||I was walking down Saint Nicholas Avenue I saw all of these Negroes hollering and running North from 125th Street
LAFB-1980||some of them would load it down with armfuls of stuff
LAFB-1981||I remember it was the bandleader Fletcher Henderson's nephew shorty Henderson who told me what it happened
LAFB-1982||Negroes was smashing store windows and taking everything they could grab and carry
LAFB-1983||Furniture food Jewelry close whiskey within an hour every New York City Cop seem to be in Harlem
LAFB-1985||just recently I ran into shorty Henderson on 7th Avenue we were laughing about a fellow whom the riot had left
LAFB-1986||the nickname of left feet in a scramble in a woman shoe store somehow he grabbed five shoes all of them four left feet
LAFB-1987||and we left about the scared little Chinese whose restaurant didn't have a hand laid on it because the rioters just about convulsed laughing when they saw the sign the Chinese and hastily stuck on his front door me colored too
LAFB-1988||after the riot things got very tight in the mall
LAFB-1989||it was terrible for The Nightlife people and for those Hustlers whose main income had been the white man's money
LAFB-1990||the 1935 Riot had left only a relative trickle of the money which had poured into Harlem during the 1920s and now this new ride and did even that trick
LAFB-1991||today the white people who visit Harlem and this mostly on weekend nights are hardly more than a few dozen who do the twist the frug the Watusi and all the
LAFB-1992||best of the current dance crazes and Smalls Paradise on now by the great basketball champion Wilt the stilt Chamberlain who draws crowds with his big clean all American athlete image
LAFB-1993||most white people today a physically afraid to come to Harlem and it's for good reasons to even for Negroes Harlem nightlife is about finished
LAFB-1994||most of the Negroes who have money to spend or spending it downtown somewhere in this hypocritical integration in places where previously the police would have been called to haul off any negro insane enough to try and get in
LAFB-1996||those Rich whites could afford it when they used to throw away their money in Harlem but negros
LAFB-1997||afford to be taking that money downtown to the white man
LAFB-1998||Sammy and I on a robbery job got a bad scare a very close call
LAFB-1999||things have grown so tight and Harlem that some hustlers have been forced to go to work
LAFB-2000||even some prostitutes had gotten jobs as domestics and cleaning out Office Buildings at night
LAFB-2001||the pimping was so poor Sammy had gone on the job with me
LAFB-2002||we had selected one of those situations considered impossible
LAFB-2003||but whenever people think that the gods will unconsciously grow gradually more relaxed until sometime those can be the easiest jobs of all
LAFB-2004||but right in the middle of the ACT we had some bad luck a bullet grazed Sammy we just barely escaped
LAFB-2005||Sammy fortunately wasn't really hurt we split up which was always wise to do
LAFB-2006||just before Daybreak I went to Sammy's apartment his newest woman one of those beautiful but hot-headed Spanish Negroes was in there crying and carrying on over Sammy
LAFB-2007||she went for me screaming and clawing she knew I'd been in on it with him
LAFB-2008||I bended or off not able to figure out why Sammy didn't shut her up I did and from the corner of my eye
LAFB-2010||we soon made up on the surface but things never are fully write again
LAFB-2011||anyone you have seen trying to kill you intuition told us that we had better lay low for a good while
LAFB-2012||the worst thing was that we've been seen the police in that nearby Town had surely circulated our general description
LAFB-2013||I just couldn't forget that incident over Sammy's woman
LAFB-2014||I came to rely more and more upon my brother Reginald is the only one in my world I could completely trust
LAFB-2015||Reginald was lazy I discovered that
LAFB-2016||Ed quit his hustle all together but I didn't mind that really because one could be as lazy as he wanted if he would only use his head as Reginald was doing
LAFB-2017||it left my apartment by now he was living off his Old Settlers woman when he was in town
LAFB-2018||I had also taught Reginald how he could work a little while for a railroad then use his identification card to travel for nothing and Reginald love to travel
LAFB-2019||several times you done visiting all around among our brothers and sisters
LAFB-2020||they had now begun to scatter two different cities
LAFB-2021||in Boston Reginald was closer to our sister Mary then to Ella who have been my favorite most Reginald and Mary will quiet types and Ella and I were extroverts and shorty in Boston had given my brother a royal time
LAFB-2022||because of my reputation it was easy for me to get into the numbers racket
LAFB-2023||that was probably Harlem only hustle which hadn't slumped in business
LAFB-2024||in return for a favor to some white mobster my new boss and his wife are just been given a six-month numbers banking privilege for the Bronx railroad area called Mott Haven yards
LAFB-2025||the white Mobsters had the numbers racket split into specific areas a designated area would be assigned to someone for a specified. Of time
LAFB-2026||my boss's wife at Ben Dutch Schultz his secretary in the 1930s during the time when Schultz headstrong on
LAFB-2027||his way into control of the Harlem numbers business
LAFB-2028||my job now was to ride a bus across the George Washington Bridge where a fellow was waiting for me to hand him a bag of numbers betting slips
LAFB-2029||we never spoke I cross the street and catch the next bus back to Harlem
LAFB-2030||I never knew who that fella was I never knew who picked up the bedding money for the slips that I handled you didn't ask questions in the rackets
LAFB-2031||my boss's wife and Gladys Hampton were the only two women I ever met in Harlem who's business ability I really respected
LAFB-2032||my boss's wife when she had the time and the inclination to talk would tell me many interesting things
LAFB-2033||she would talk to me about the duck show today's about the deals that she had known about graft paid to officials rookie cops and shyster lawyers right on up into the top levels of police and Pieology
LAFB-2034||she knew from personal experience how crime existed only to the degree that the law cooperated with it
LAFB-2035||she showed me how in the country's entire social political and economic structure the criminal the law and the politicians were actually Inseparable partners
LAFB-2036||it was at this time that I change from my old numbers man the one I use since I first working Smalls Paradise he hated to lose a heavy player but he readily understood why I would now want to play with a runner of my own outfit
LAFB-2037||that was how I began placing my bets with West Indian Archie I've mentioned him before one of Harlem's really bad Negroes one of those former Dutch Schultz strong-arm man around Harlem
LAFB-2038||West Indian Archie had finish time in Sing Sing not long before I came to Harlem
LAFB-2040||he was able to file all the numbers in his head and write them down for the banker only when he turned in his money this made him the ideal Runner because cops could never catch him with any betting slips
LAFB-2041||I've often reflected upon such black veteran numbers man as West Indian Archie
LAFB-2042||if they had lived in another kind of society their exceptional mathematical talents might have been better used but they were black
LAFB-2043||anyway it was status just to be known as a client of West Indian arches because he handled only sizable Bettors
LAFB-2044||you also required integrity and Sound Credit
LAFB-2045||it wasn't necessary that you pay as you played Euchre
LAFB-2046||a West Indian what you buy the week he always carried a couple of thousand dollars on him his own money
