MCDM-499||Nicodemus The Count of Rennes that's the reason Nicodemus is the count of Rennes if you missed that episode and at that
MCDM-500||moment I mean nothing about Lord Edmond had changed he was still the imperious haughty thirteen-year-old kid but at
MCDM-501||that moment they really liked this character because everything he had done had been consistent making Nicodemus the
MCDM-502||count of Rennes had been a noble activity just as insisting on being called sire or my lord was another NPC I
MCDM-503||enjoyed running was edrick I think you got to see me run edrick in the stream with girls playing variks now ed ryx job
MCDM-504||was to support Vargas he was an npc in for kisses party edrick was a cleric I created him because Gertz was playing by
MCDM-505||himself and in case he got in over his head I want to make sure that he had some help so of course the best support
MCDM-506||character is a cleric but I never wanted Adric to feel like an equal edrick was always someone who looked up to vork
MCDM-507||asst edrick was a peasant edrick was a cleric but he was just one of the guys at the church that you know lit candles
MCDM-508||and stuff like that he was never a hero he was never an adventurer he's very pious he knows some things he knows a
MCDM-509||lot about the church but doesn't know anything about the wide world he was always deferring to curse he was always
MCDM-510||deferring to variks there were several points in the adventure where Gertz turned to me as edrick and tried to get
MCDM-511||me to give him some clues as to what he should do but I never did I would give him several options but some of them
MCDM-512||would be crazy that forced Gertz to lead I got the sense that Gertz want to collaborate but
MCDM-513||I'm the DM don't collaborate with me lead be a leader be a hero and with edrick in tow it was kind of easy for
MCDM-514||vork us to be leader I know Eric's motivation which is survive follow forcas but now I need to know his
MCDM-515||mannerism I know what he would say now I need to know how he would say it I gave edrick and I kind of at the time thought
MCDM-516||of this as kind of cheating I gave edrick one mannerism and that is I gave him a stammer I watched a lot of I
MCDM-517||Claudius when I was a kid derek jacobi playing Claudius had a stammer so I just ripped that off you
MCDM-518||know derek jacobi the actor did a lot of work and study people that had a stammer wouldn't be comedic it wouldn't be
MCDM-519||disrespectful and I just stole it giving him a stammer giving this one kind of flamboyant mannerism unlocked all this
MCDM-520||other stuff about his personality that I didn't know until I was playing him he would be self-conscious of his damn er
MCDM-521||he would have issues with self-confidence he was constantly saying Devore Kasai I mean useless it was up to
MCDM-522||vork us to give him encouragement to say we're gonna make it you're gonna be okay and for Kurtz that made playing vork cos
MCDM-523||feel like playing a hero all that just from the stammer and I didn't worry about the self-confidence in the self
MCDM-524||loathing about that character until I was playing him he was born once I started playing him then when I stopped
MCDM-525||he died these were things I discovered as I was playing him based solely on the idea that he wanted to serve vork as he
MCDM-526||was a follower he want to get out of here alive and he had a stammer my last example and we're pretty close to the
MCDM-527||end of this video is a normal everyday peasant a farmer that the revenant vow met on their first adventure the players
MCDM-528||were first level in the adventure was against the cult of the reptile God we should probably do a series on the
MCDM-529||adventures that I have run and that I liked because if I tell you what I learned from running that adventure then
MCDM-530||you can run it and I will have saved you some time for my money against the cult of the reptile God is maybe the best
MCDM-531||starting adventure and it's all about this cult that has taken over a town when the players come to the town and
MCDM-532||against the cult of the reptile God they meet three kinds of NPCs first they meet normal everyday NPCs who just feel like
MCDM-533||our town is cursed and a lot of the people that I knew and grew up with are acting strange
MCDM-534||second they meet some of those people who are acting strange they're under the effect of a domination spell third they
MCDM-535||meet some of the bad guys in charge of this cult the ones who are putting the other NPCs under the domination spell
MCDM-536||but early on the players don't know this yet the first NPC the players met was a
MCDM-537||farmer they knew there was something going on in the town and they kind of used this farmer as a case study
MCDM-538||patient zero what's going on here in this town let's talk to this farmer so I thought about who is this guy he's a
MCDM-539||farmer he wants to provide for his family that's his goal that's what makes him toil all day in the Sun and I
MCDM-540||thought about how is he going to express himself what is this personality well that came from the way the PCs reacted I
MCDM-541||just made sure that this guy was incredibly deferential he wouldn't look the heroes in the eye if they asked
MCDM-542||questions he answered simply and didn't say any more than he had to because this guy has met adventures before he knows
MCDM-543||their trouble and he knows that the best thing to do is just leave them alone he thinks of adventures as being above him
MCDM-544||he's stuck here on a farm they can go travel the world yeah they're going to risk their lives doing crazy stuff but
MCDM-545||they're gonna make a lot of money doing it so from his point of view they're not noblemen but they are of a
MCDM-546||higher station than he is and anytime a peasant like him is interacted with them the best thing to do is just get out of
MCDM-547||there alive say as little as possible and try to make it out of the encounter alive that actually proved a little bit
MCDM-548||difficult because when he wasn't immediately forthcoming and open and just answer every question the heroes
MCDM-549||had they started to kind of get angry at him he was so deferential and monosyllabic that the players started to
MCDM-550||think maybe he is one of these dominated NPCs one of the players actually tried to provoke this farmer he would push him
MCDM-551||around flick his ear he'd dug up his vegetable garden and the funny thing about that was the more aggressive this
MCDM-552||PC this player character was the more convinced this farmer was that his beliefs regarding adventurers were right
MCDM-553||they are terrible people just leave them alone after the aggressive PC was done bullying this farmer the other players
MCDM-554||made him feel bad so the PC said well no hard feelings and through this farmer gold piece and the farmer literally does
MCDM-555||not react to the gold piece just falls in the dirt that was the farmers incredibly passive-aggressive way of
MCDM-556||telling the heroes to go screw I don't want your money once again I had created a dramatic
MCDM-557||situation I didn't really do it on purpose I just thought about what is this character's motivation and how does
MCDM-558||he express himself and at the end of that process we got to a point where one of the characters was bullying this guy
MCDM-559||and then as a kind of half-assed apology throws him a gold piece well that's exactly the kind of behavior that makes
MCDM-560||NPCs like this farmer hate adventures because all they think about is gold the gold piece itself became this kind of
MCDM-561||symbol for the relationship between adventurers and peasants and after that adventure that night I actually wrote up
MCDM-562||a whole scene I'll included in the doobly-doo covering what this farmer did immediately after encountering the
MCDM-563||heroes and I used it as an example to illustrate how bad things have gotten in the town a lot of people were leaving
MCDM-564||the town which is what the cultists wanted and that proved to be a very effective way to show the players how
MCDM-565||they were perceived and kind of motivate them to be better characters because after I wrote that thing they felt
MCDM-566||really bad for this farmer now in each instance I don't think any of those NPCs I just talked about were particularly
MCDM-567||flamboyant characters but they each provided memorable moments in the campaign because I focused on the
MCDM-568||characters motivation rather than some outrageous accent it grounded these characters and it made the world feel
MCDM-569||more real and it gave the players a lot of perspective on how they were perceived and how the world works
MCDM-570||hopefully some of this advice is useful but it's the advice I've got so if you have any questions please come by the
MCDM-571||comments and let me know maybe we'll do another video later NPCs part 2 I've had a couple people online
MCDM-572||plain isn't the right word but bring up the fact that we do fewer running the game videos now when we do campaign
MCDM-573||Diaries more and I talk about movies every once in a while I just want everybody know that like the campaign
MCDM-574||Diaries a lot of people like the campaign Diaries I think there's a lot of great DM advice in them and because
MCDM-575||we play every week and people are kind of engaged with the story I feel like I have to do those those are the minimum
MCDM-576||campaign Diaries I don't wanna get behind on and I don't want to skip any because then people who are watching
MCDM-577||they'll be like well wait what happened my goal is absolutely to continue doing running the game videos but the campaign
MCDM-578||Diaries are kind of the first video I have to make each week is how to D&D go that week and then sometimes I'm struck
MCDM-579||by an idea like I did that video on 2001 that a lot of people really liked but I know some people that's not what they
MCDM-580||come here for that's why I put all these videos in different playlists and I believe you can subscribe to the
MCDM-581||playlist you want otherwise the channel is called Matthew Colville it's not called how to be a better DM so you come
MCDM-582||here you get the kind of stuff I'm interested in I've had a couple of people actually following my campaign
MCDM-583||diary start doing their own campaign Diaries and I thought they were really cool i link to both of them in the
MCDM-584||doobly-doo I hope people do more I think the campaign diary and YouTube is a great way to memorialize your game plus
MCDM-585||who knows people like really engage with the story that's happening at your table that's it for the NPC video folks I hope
MCDM-586||there was some useful advice in there as usual there are no ads in front of my D&D content I do not have a patreon if
MCDM-587||you want to help support the channel I encourage you to come by my author page on Amazon there's a link in the
MCDM-588||doobly-doo I am an independent fantasy author that means I write fantasy novels and I sell them direct to you I am
MCDM-589||philosophically opposed to middleman it's one of the reasons I love YouTube I don't advertise my books in the movie
MCDM-590||stuff I do so you will see ads in front of those hopefully it's not too annoying until next time peace out
MCDM-591||it's well after midnight somewhere deep in the dungeon the players have chosen a room they already cleared out to hole up
MCDM-592||for the night and rest many of them are wounded they used up many spells they need to rest they need to spend the
MCDM-593||night in the dungeon fearful of the creatures that lurk outside they set up two watches two hours into the second
MCDM-594||watch check the door of an war priest with the high wisdom and therefore high perception here's something something
MCDM-595||outside the door he gestures to Nicodemus the half war fighter now count Nicodemus of rend Nicodemus looks from
MCDM-596||Keck to the door Nicodemus hasn't heard anything but he watches as Keck picks up his Moll and prepares for battle
MCDM-597||Nicodemus slowly and quietly stands up preparing his great two-handed war axe wound Keck presses his ear to the door
MCDM-598||and listens there is something without he says Nicodemus hisses keep your voice down
MCDM-599||what you hear on the other side of the door they hear a sound something sniffing they hear heavy footprints
MCDM-600||there's something just on the other side of the door that can smell them this is sniffing them out Keck wielding the
MCDM-601||two-handed Maul of zarach the lawgiver looks at Nicodemus and says we should attack should use the element of
MCDM-602||surprise Nicodemus looks down at the dwarf and says are you crazy wait Keck restrains
MCDM-603||himself they both listen at the door and they hear the sniffing sound move on whatever was on the other side of the
MCDM-604||door whatever was looking for them didn't find them and the night passes uneventful II that's because I asked the
MCDM-605||players to make two roles for random encounters I use a d12 I'll explain why later and I say if you roll an 11 or a
MCDM-606||12 there's a random encounter and the players rolled a 6 for the first watch and a 10 for the next watch so I just
MCDM-607||role played the process of something in the dungeon the players don't know what on patrol looking for them sniffing for
MCDM-608||them but in this case whatever was on the other side of the door whatever is looking for them didn't find them hey
MCDM-609||everybody matt covert here we're going to talk about some proper dungeon master advice this episode is about random
MCDM-610||encounters we're also going to do a giveaway at the end of the episode tied to a certain number of subscribers so
MCDM-611||stay tuned it's related to the map building stuff we've been doing on Twitch I hope you've had a chance to
MCDM-612||check it out if not don't worry I'm probably gonna make a video at the end summarizing the whole thing I didn't
MCDM-613||always use random encounters in my game in fact I know some dm's never use them I think it's purely down to your style
MCDM-614||of play and as a dungeon master my style of play changes almost with every campaign I run the game I'm currently
MCDM-615||running at Turtle Rock Studios is kind of a throwback to the old school way of running D&D we're just getting
MCDM-616||point A to point B is dangerous and that's where the idea of random encounters comes from so under no
MCDM-617||circumstance should you feel as though random encounters are something that you should use or have to use it is a tool
MCDM-618||in your toolbox and I really think it's down to your style of play it's something that either you do often in
MCDM-619||this campaign because you're going for a certain feel or it's something you hardly ever do because your game is more
MCDM-620||narrative focused it's more story driven we inherit the idea of random encounters from a game that existed before Dungeons
MCDM-621||& Dragons in fact if you went and bought the three little brown booklets the original version of D&D that was
MCDM-622||published in 1974 it explicitly told you that in order to play D&D you needed this other game actually needed two
MCDM-623||other games you needed chainmail in order to handle combat and then you needed something from another company
MCDM-624||entirely this was not a game that TSR made it was a game that they all owned and used from a company called Avalon
MCDM-625||Hill it was called outdoor survival there's a picture of it over here it was one of their bookcase game series not
MCDM-626||entirely unlike merchants of Venus which is a game I love I have lots of Avalon Hill bookcase games Avalon hills outdoor
MCDM-627||survival was its own self-contained game and it was a game that all the folks who ran and played Dungeons and Dragons back
MCDM-628||in 1974 all owned so it was an easy thing for them to just use it to deal with Overland movement you can see the
MCDM-629||outdoor survival map here was always the same map and the idea was that depending on the scenario you would start in one
MCDM-630||hex and your goal was to get remember hexes we're back to hexes you would start in one hacks and try to get to
MCDM-631||another hex and the farther away they were the harder it was to do and you would have to roll on these various
MCDM-632||charts to see what happened as you tried to go over these mountains or go through this forest and just getting from point
MCDM-633||A to point B was the entire game of outdoor survival the game they were playing was called Dungeons and Dragons
MCDM-634||the idea was that the game master designed a dungeon the rules explicitly tell the dungeon master you need to come
MCDM-635||up with six levels of dungeon before you start your first game the idea of playing in a city or playing in the
MCDM-636||wilderness or having an entire adventure just take place in the town did not occur to these guys when they first
MCDM-637||started the fun the juice of the game was exploring dungeons and each Game Master had his own dungeon we don't
MCDM-638||really play that way anymore but when you went from the dungeon back to town you would use this other game you would
MCDM-639||use outdoor survival to determine what happened when you got from the dungeon back to town
MCDM-640||just getting the loot the treasure that you got from the dungeon back to your town so you could spend it so you could
MCDM-641||use it was a big deal is considered an accomplishment that should explain a lot of how random encounters in Overland
MCDM-642||movement work and it also kind of explains some of the monsters in D&D there are lots of monsters and dungeons
MCDM-643||and dragons that you would probably never encounter if you never used overland movement random encounters in
MCDM-644||fact there used to be a stat monsters had a stat in the monster manual in the original Monster Manual and the stat was
MCDM-645||percent chance in lair the idea being if you encountered this monster as a result of an overland movement random encounter
MCDM-646||what are the odds that you came across it while it was in its lair you know it's a very different experience to
MCDM-647||fight a black dragon for instance on the wing so to speak it sees the players camp as it flies over hunting during the
MCDM-648||night that's one experience there the dragon kind of has the advantage it can swoop down it can breathe acid on you
MCDM-649||and it can fly away when it's wounded but fighting a black dragon in its lair is a very different experience for one
MCDM-650||thing that's where it's treasure is if you kill the black dragon because it attacked you while you were making camp
MCDM-651||in the middle of the forest then you probably didn't get any treasure as a result but if you fight it while it's in
MCDM-652||its lair then you will get treasure but the flipside of that is the black dragon can't really retreat this is its lair
MCDM-653||there's nowhere for it to retreat to so if you fight a black dragon out in the forest out in the wilderness in the
MCDM-654||middle of the night if things get too hairy for the heroes or if the black dragon gets too wounded the dragon can
MCDM-655||fly away not so in the lair so you get a sense of how built into the bones of Dungeons & Dragons random encounters are
MCDM-656||nowadays I think a lot of games are more narrative and story focused and so the idea of exploring of just getting from
MCDM-657||point A to point B being dangerous I don't think we use that I think it's somewhat unfashionable it is mentioned
MCDM-658||in the Dungeon Master's guide and there are other uses for it besides just making overland movement difficult
MCDM-659||random encounters are also incredibly useful in the dungeon in fact I think they are probably used in the dungeon
MCDM-660||these days more than for Overland movement I think in this day and age if you're just trying to get from point A
MCDM-661||to point B the only stuff that will happen to you is stuff that the dungeon master has already cooked up like
MCDM-662||somebody ambushes you like maybe bandits ambushed you it depends on the adventure you're running even dungeon crawls I
MCDM-663||think in this day and age or somewhat out of fashion I still use them I love dungeon crawls I
MCDM-664||probably always will but a lot of adventures these days are more narrative and story focused so the bad guys that
MCDM-665||you're fighting aren't all you know collected in some underground complex so it tells you
MCDM-666||a lot about me as a dungeon master that I am running a game that not only features dungeons like proper
MCDM-667||underground complexes but also making Overland Movement dangerous I am deliberately running a game that is a
MCDM-668||kind of throwback to the games they ran in 70s in the 80s because I have a kind of nostalgia for that even though I only
MCDM-669||started playing in the mid to late 80s I have this crazy nostalgia for an era that I didn't belong to we need a word
MCDM-670||for that in English nostalgia for an era that you weren't a part of so you may find that like wilderness survival a
MCDM-671||dungeons aren't to your taste which is fine but if you do use dungeons if you do have players exploring these
MCDM-672||underground complexes or castles or whatever where there are several combat encounters in a row and there's no way
MCDM-673||for the players to do it all in one day then it may be useful for you to use random encounters because ultimately the
MCDM-674||idea of exploring this underground complex of dealing with all these monsters that are all grouped together
MCDM-675||is a question of resource management players are of course risk-averse they want to risk as little as possible so if
MCDM-676||you give them the chance they will rest they'll take a long rest after every encounter I mean why not realistically
MCDM-677||speaking if you had to fight a bunch of orcs in order to survive just one encounter with orcs would probably wipe
MCDM-678||you out and you would say you know what let's stop and rest until we are fully healthy and have all our spells back so
MCDM-679||random encounters in the dungeon are a way to counter that desire it is a perfectly natural desire there was
MCDM-680||nothing wrong with the players deciding that they want to spend the night after the first encounter but you want to
MCDM-681||discourage that because it robs the adventure of tension and that's the whole point of doing this is drama right
MCDM-682||tension and resolution random encounters also reinforce the idea that the world is a dangerous place that the dungeon is
MCDM-683||dangerous to explore and that the wilderness is dangerous to explore of course this has to scale by level a
MCDM-684||ninth level party probably no longer worries about getting ambushed by goblins in the middle of the forest in
MCDM-685||fact a nice level party probably has lots of ways of getting from point A to point B that do not involve walking
MCDM-686||there so to a certain extent the idea of overland movement causing random encounters is based on the hero's being
MCDM-687||somewhat low level so let's talk about how I do it let's talk about how I run random encounters and of course if
MCDM-688||you've watched my videos you should know that I am NOT saying this is the right way to do it it's not it's not even the
MCDM-689||only way I have done it it's just the way I'm doing it right now typically the players start in town and
MCDM-690||they have some rumors so I'm word someone they've met that has told them about someplace out in the
MCDM-691||wilderness that is relevant to their interests like there's a goblin mine in the swamp or like those are ruined keep
MCDM-692||in the forest and the players can count the number of hexes between where they're starting where they're trying to
MCDM-693||get to and again we're back to hexes right now you're starting to understand why I like them they provide a nice
MCDM-694||little unit of measurement the players count the number of hexes and I have them make one roll for every wilderness
MCDM-695||hex they move through now that means if they're going a long way away if they're going 10x is 240 miles away they're
MCDM-696||gonna be making 10 rolls which is why I tend to have all the wilderness stuff near where the players are so let's
MCDM-697||imagine that the place they're trying to get to is 5 hexes away from the town they're starting in that means they have
MCDM-698||to make 5 rolls that's 5 chances for them to have a random encounter there are lots of ways to determine whether or
MCDM-699||not there was a random encounter in the woods and in fact I've played games where it was modified by whether or not
MCDM-700||there was a ranger in the party Rangers made it less likely that there would be a random encounter and in fact I also
MCDM-701||think that in the players handbook actual Rangers and fifth addition are impossible to surprise in their favorite
MCDM-702||terrain which is fantastic and actually at one point resulted in the players making different decisions when they
MCDM-703||traveled which i think is neat they went through the forest instead of taking the road because they had a ranger with them
MCDM-704||whose favourite terrain was forest and they were told that the road was dangerous that there were bandits on the
MCDM-705||road and in fact if they had taken the road they would have been ambushed by bandits but they listened to the Ranger
MCDM-706||who said we should go through the forest and as a result there was no encounter but typically what I do is for every hex
MCDM-707||they're moving through in the wilderness this doesn't count typically on roads or in civilization every hex they're moving
MCDM-708||through in the wilderness I have them roll a 12-sided die because I just like 12 sided dice and I don't think they get
