MCDM-289||with my voice and called it good and I think it was flamboyant enough that it made it somewhat easy to copy so if
MCDM-290||you're looking for a trick as to how to make an npc memorable unfortunately there really isn't one other than just
MCDM-291||going for it you just have to go for it some of your friends are going to laugh some of them are going to think that
MCDM-292||it's ridiculous it might turn some of them off but that's because you're completely new at this years from now
MCDM-293||after you've been doing this for a while you'll be super confident and your friends will be really impressed if you
MCDM-294||want to make an outrageous character if you want to make it in peace either your players are going to remember and you
MCDM-295||want to go for an accent or something like that look I'm not a dialogue coach but I can tell you a couple of tricks
MCDM-296||that I've learned over the years first of all performing an npc in a memorable way does not rely on an accent you heard
MCDM-297||my Dragonborn voice is that an accent I don't think so I think it's just a crazy way of talking maybe what's the
MCDM-298||difference we're not an accent I don't know but I often give NPCs tics or ways of speaking of phrases they deploy or
MCDM-299||I'll change my voice up I'll go into a higher or a lower register or there'll be some words I avoid using you know
MCDM-300||like data doesn't use contractions for instance and I think there he screwed that up a couple times but that you get
MCDM-301||the point you know I'm the lead rider at Turtle Rock Studios I wrote 98% of the dialogue for evolve and when I'm writing
MCDM-302||a character like Abe who Matt mercer played when I'm writing a character like Abe or Hyde these are characters that
MCDM-303||deploy a lot of profanity that's just their natural language but when I write a character like Cabot that dude never
MCDM-304||swears Cabot doesn't swear for the same reasons that Abe and Hyde do it's how he was raised but it also says a lot about
MCDM-305||him as a person as leader so the choices you make in the words you deploy whether or not you swear has a huge impact on
MCDM-306||how your player is going to perceive the character so it's not all about accents and funny voices I really want to break
MCDM-307||the back of that idea because again if you watch a critical role you're gonna think oh playing D&D means doing accents
MCDM-308||it means getting into character now that's one way to do it and it's a lot of fun I am typically the most
MCDM-309||actively the most theatrical character at any given table I'm at so obviously I like doing that stuff but the people I
MCDM-310||like playing with the most the best DMS I've ever played with my one of my favorite all-time favorite DMS never did
MCDM-311||any voices he never role played in character he would always describe what the PC NPCs were doing in third-person
MCDM-312||that is perfectly legitimate I am giving you permission to be you can be a perfectly good DM and your players will
MCDM-313||love playing with you and you never speak in character once you just describe what the NPCs are doing or what
MCDM-314||they're saying in an otherwise neutral way you can say the NPC gets angry but that doesn't mean you have to shout so
MCDM-315||consider if you're going to role play the character if you're going to try and get in character it doesn't have to be
MCDM-316||about accents we'll talk about accents in a second but I don't want that to be the overwhelming like you know Gilmour
MCDM-317||doesn't really have an accent he has a flamboyant Broadway personality but is that an accent right I'd still love
MCDM-318||broadway personality as aces one of the things i do as a writer I also do this as a DM but I learned
MCDM-319||this stuff as a I cut my teeth on this as a writer and I did in texts for years and eventually I was able to do it in my
MCDM-320||normal speech is I deploy Latin or anglo-saxon Old English Old English words or Latin words depending on
MCDM-321||whether or not this is an intelligent well-read character or not intelligent well-read characters often use in the
MCDM-322||real world often use Latin eight world they'll say planet where as somebody who's a you know a down-to-earth
MCDM-323||salt-of-the-earth uneducated person would say world that has a big impact on how my NPCs are perceived the players
MCDM-324||can tell this guy's smart based on not what he says but how he says it when they need a farmer when they need a
MCDM-325||peasant that peasant might say the same things that an educated the wizard from the tower might say but he'll say in a
MCDM-326||completely different way he'll choose different words to use now that is advice I don't know if it's a good
MCDM-327||advice because it's super esoteric it's the kind of thing you really have to work at for years but the good thing
MCDM-328||about running Dungeons and Dragons and basically having D&D as a hobby is that the stuff that you start trying now is
MCDM-329||gonna pay off for years you know I have no problem I was talking to my friends at work I bought a brand new a big huge
MCDM-330||tool chest to store all my stuff in and more than one person commented on how expensive this thing was and I was like
MCDM-331||look this thing I'm gonna be using this in in many cases every week for the rest of my life so don't be afraid to try
MCDM-332||accents also let's talk about accents don't be afraid to try accents don't be afraid to try stuff like choosing
MCDM-333||different words in your speech because even though you're gonna suck at it now eventually you will be pretty good at it
MCDM-334||all right so accents look the best way I think to learn accents is to have a really long drive so if you don't if you
MCDM-335||live close to work or school move because if you've got about a half an hour long drive I think more than that
MCDM-336||will be taxing on the head meats if you got that half an hour long drive you can listen to audiobooks and you can listen
MCDM-337||to NPR NPR is a great source I mean I listen to NPR because I'd like to know what's going on but I listen to NPR
MCDM-338||often they are interviewing people from other countries and you get or other parts of America and you get to hear all
MCDM-339||these great accents and I'm alone in the car driving along and I will parrot the accent back and not only the tone of
MCDM-340||their voice and where they put the accents and stuff like that but also stuff like word shorts again word choice
MCDM-341||is huge so have a half-hour long drive listen to NPR practice the accents and not don't just listen and don't just
MCDM-342||pare it back the inflections in their voice but also notice the words they shoes I'm actually
MCDM-343||kind of opposed I mean I in as far as this is a philosophical issue but I'm kind of I always find it weird when
MCDM-344||people are playing Dungeons & Dragons and they start putting on English accents unless your game unless you're
MCDM-345||playing a Robin Hood game or King Arthur game or my friend Jim's game which was set in Albion which was fantastic unless
MCDM-346||you're playing a game set in England why does your character have an English accent you know one of the brilliant
MCDM-347||casting choices of all time I think in my personal opinion is casting Richard Boone as Smaug but there's a lot of
MCDM-348||crazy accents in the rankin/bass Hobbit and you know it's funny looking back I remember thinking that Hobbit movie the
MCDM-349||animated Hobbit was kind of cheesy but compared to the train wreck that was Peter Jackson's version Wow
MCDM-350||the animated Hobbit is now is grown in my estimation but Richard Boone's Smaug is amazing listen to the way this dude
MCDM-351||talks well see I smell you feel your air and I hear your breath come along help yourself
MCDM-352||there's plenty and spare right that is not that dude is not that's the way that guy talks he's not putting on an accent
MCDM-353||he's just Richard Boone he's a great huge fact he was famous before maybe he's not famous for being Smaug but he
MCDM-354||was famous or well-known for often being the heavy the bad guy in westerns he's just doing his normal voice that's just
MCDM-355||how he talks but it's super memorable so I'm a huge critic of that fake British accent that's why a lot of characters of
MCDM-356||my novels speak like modern humans because that's how it would have felt if you were in a medieval era you would if
MCDM-357||you were born and raised in the eleven 30s the people around you spoke from your point of view contemporary English
MCDM-358||and we speak contemporary English so so don't feel pressure to do a British accent it's kind of ridiculous feel free
MCDM-359||to speak in your normal voice feel free to affect other American accents here's one secret uh when you first do
MCDM-360||something crazy when you first do a flamboyant character at first your players first impression is going to be
MCDM-361||that's crazy what is our DM doing but only after 30 seconds 45 seconds a minute it will stop
MCDM-362||being this crazy thing you're doing and it will just become who this character is you just got to stick to your guns
MCDM-363||another thing that's great about having a half-hour long drive is listening to audiobooks I listen to a lot of the
MCDM-364||Terry Pratchett books read by Stephen Briggs if you can find those I strongly recommend reading them
MCDM-365||a because terry pratchet is a genius and B because Stephen Briggs I mean there are so many characters in Terry
MCDM-366||Pratchett novels I really do not envy the narrator of them because he's got to find a way to make all of these
MCDM-367||characters this huge cast all sound distinct so he gives all these different characters different accents in order to
MCDM-368||differentiate them and I'll be driving along in my car and I'll just be parroting back Stephen Briggs his
MCDM-369||versions of these accents one of the things I love about Stephen Briggs his choices as a narrator is it he makes all
MCDM-370||the doors well at least I think it's a Welsh accent what do I know so that's the first I always try to make sure that
MCDM-371||the first and best advice is upfront I think people when they watch critical role they are inspired by the NPC's Matt
MCDM-372||creates and they want to know how does he do it and the most memorable characters he has created are not
MCDM-373||Gilmore is a pretty sophisticated dude but there is a the first impression he gives is very strong and that's because
MCDM-374||matt has made these characters deliberately outrageous flamboyant characters and there's no trick to that
MCDM-375||you just have to be willing to look like a jackass for a little while Matt does not look like a jackass when he does it
MCDM-376||because he's been doing this for decades well not decades I don't know a long time you get the point but this is now I
MCDM-377||think where we get to the meat of this video and that is I I question the desire to make memorable NPCs I question
MCDM-378||it I'm not saying it's a bad idea I'm just saying think about what you're asking why should n P C's be memorable
MCDM-379||what is the purpose of NPCs I as a DM I do not sit around thinking how am I going to make this NPC memorable that is
MCDM-380||honestly something I have really never worried about I worry about how to make bad guys memorable we did a whole video
MCDM-381||on that but when I'm making NPCs for the characters to meet really my goal is to make them plausible it's to give the
MCDM-382||players opportunities to see how they are perceived by the world around them and give them characters to react to and
MCDM-383||interact with it's that moment where other characters treat the players like a hero that makes them feel heroic so my
MCDM-384||NPCs are typically there to either show the players how they are perceived in a positive or negative light when my
MCDM-385||players start off at first level the people that they meet are often suspicious of them because they are
MCDM-386||itinerant adventurers and trouble follows them the town's folk are typically happy being town's folk and
MCDM-387||it's only once these adventures show up that all of a sudden their problems with goblins and stuff like that later on
MCDM-388||once they've saved the town the people are grateful to them and seeing that both instances the goal of the NPC is to
MCDM-389||show the players how they are perceived first with suspicion but then later with gratitude and that transition from
MCDM-390||suspicion to gratitude is really rewarding I've seen it pay off with dozens of players they love that feeling
MCDM-391||of having once been treated badly by these NPCs or at least with suspicion sometimes with open contempt because of
MCDM-392||the reputation that adventurers have they love that feeling of having saved the blacksmith daughter and coming back
MCDM-393||and now these people are super grateful to them that is a very rewarding experience is it memorable does it make
MCDM-394||the NPC's memorable I don't think so they remember that experience though they remember that feeling and it makes
MCDM-395||them feel like heroes so my goal with NPCs is to kind of show the players either how they are perceived or how
MCDM-396||different elements of the world are perceived often my players will read something I've written in some
MCDM-397||background for my campaign and they don't know exactly how it works they can't imagine it but once they meet the
MCDM-398||NPC's then they start understanding how this stuff works like for instance they read the one sheet I hand out and they
MCDM-399||think the invincible overlord must be some tyrannical evil entity that everyone's terrified of but then once
MCDM-400||they start playing they realize oh no they meet people and the people are like well be invincible overlord is not we've
MCDM-401||never seen him we don't know anything about him they have local problems each NPC they meet is an opportunity for me
MCDM-402||to kind of convey a point of view what do people think of the Baron what do people think of the invincible overlord
MCDM-403||what do people think of the Dragon Knights I do not worry about backgrounds in fact I am strongly opposed to them on
MCDM-404||more than one video game project I've worked on artists people have come to me and asked me for long extensive
MCDM-405||backgrounds I don't know why they literally asked for stuff like what is this character's blood type but for
MCDM-406||whatever reason people want extensive backstories and I find that to be a huge red herring you know there's a great Q&A
MCDM-407||with Aaron Sorkin on reddit Aaron Sorkin I think one of the great writers over the last 25 years and he said he
MCDM-408||explained he's like look a character is born when they walk on stage and they die once they walk off stage they have
MCDM-409||no background before that they have no existence after that now that is an extreme viewpoint but this is very
MCDM-410||useful when running I think a lot of people feel this pressure as DMS that they need to know the history of these
MCDM-411||characters no that's not true what they do need to know what is useful is what is this character's motivation and what
MCDM-412||is their personality now both of these things can be informed by their backstory but in my experience that just
MCDM-413||comes out actually as you play them it's not something you have to have worked out
MCDM-414||ahead of time so do not feel like you have to sit down with every NPC and ride out this long backstory that's
MCDM-415||ridiculous motivation and personality what does this character want and then how do they
MCDM-416||express themselves you know when they meet a guard what is a guard want a guard wants to make it home that day
MCDM-417||alive and meet his family he doesn't have to arrest anyway he doesn't have to get in a fight this one
MCDM-418||have to use his weapon and that makes him suspicious when the adventurers show up he's like oh Christ not these guys
MCDM-419||because adventurers are often bristling with weapons and they are they look different than normal people and so
MCDM-420||they're there to make the guards life difficult a town guard is going to often be suspicious of adventures and consider
MCDM-421||them this incredible annoyance you know what is the innkeep want the innkeep wants to provide first family the
MCDM-422||innkeep wants to serve food the innkeep wants to make some money it doesn't take a lot of work or even really a lot of
MCDM-423||thought to figure out what does this NPC want then the only question is what is their personality you know what they
MCDM-424||want now how do they express themselves you know peasants tend to express themselves simply and directly bards
MCDM-425||tend to be flamboyant noblemen tend to use a lot of flowery language they've been educated there are a million
MCDM-426||different kinds of mannerisms for you to choose from and I think less is more pull it back you don't have to be
MCDM-427||flamboyant you don't need to be memorable you're just trying to sell the idea that this is a real person and the
MCDM-428||real people you and I both know are typically not incredible flamboyant personalities I mean I think I have a
MCDM-429||reputation for being a really high energy this is this is the me for the video the me in real life is not like
MCDM-430||this this is my YouTube personality a mannerism can be something simple like he picks his teeth while he talks a
MCDM-431||mannerism can be something simple like he doesn't look you in the eye why doesn't this character look you in the
MCDM-432||eye is it because they are suspicious is because they're afraid of you maybe it's just because that's how they are so
MCDM-433||motivation personality what does this NPC want how do they express themselves I think the number one question I ask
MCDM-434||myself when I'm running a NPC is how does this NPC perceive the heroes if heroes occupy this weird class where
MCDM-435||they're not exactly noblemen but they're also better than peasants how where does this NPC
MCDM-436||fit in this is this NPC a peasant is the normal town's person and do they look up to the heroes and looking up to them
MCDM-437||does that mean that they're afraid of them that they admire them or do they consider the heroes unequal are they
MCDM-438||another adventurer or maybe a member of the Thieves Guild or are they a nobleman looking down on the heroes that is a lot
MCDM-439||to do with how I run an NPC I think about how do they perceive the heroes because I think I think that's the most
MCDM-440||important thing is showing the players themselves and then they worry about stuff like what is this character no
MCDM-441||obviously I know everything there is to know about this campaign setting but the NPC
MCDM-442||doesn't so I often have we talked about this in the information video I often make sure there was a very poor
MCDM-443||signal-to-noise ratio the NPC might have a lot to say but does that mean that they're right does that mean they can be
MCDM-444||trusted a farmer knows a lot about farming and he knows a lot about the local town but he does know a lot about
MCDM-445||much else if you're talking about farmers or peasants or local townspeople it's reasonable to assume that they
MCDM-446||might be really superstitious and they believe that the local force is haunted does that mean it is haunted well that's
MCDM-447||up to you but maybe not because the DM knows everything because the DM is the ultimate authority of the table there's
MCDM-448||an overwhelming tendency for the players to just accept everything your NPC's say as the gospel because it's coming from
MCDM-449||the DM so I often make sure my NPCs say things that the players immediately go oh wait a minute of course this guy
MCDM-450||thinks this because of course he thinks the force is haunted he's a peasant of course he thinks that demons abducted
MCDM-451||the blacksmith's daughter because he's never seen a goblin before if they need it dwarf NPC the dwarf advises violence
MCDM-452||because dwarves in my setting are like short Klingons their honor obsessed they love alcohol and they love
MCDM-453||fighting I've had many instances where dwarf NPC advised just a frontal assault on whatever the problem was and the
MCDM-454||players go whoa is that possible are we gonna win and the dwarf like win who cares if we win at which point the
MCDM-455||players are like okay we we can't listen to this guy I know we've talked about this before so that's how I view NPC
MCDM-456||creation I don't worry about backstory I don't worry really about accents or voices I do concentrate a little bit on
MCDM-457||mannerisms I worry about their motivation what is this NPC what did I worry about their personality how do
MCDM-458||they express themselves and then I think about what is their station what place does this NPC occupy in the world are
MCDM-459||they a peasant are they a nobleman then I think about how does this NPC view the heroes because that's I think the best
MCDM-460||thing an NPC can do is show the players themselves show them a point of view each NPCs can have a different point of
MCDM-461||view toward the characters I'll give you some examples we're gonna talk about three different NPCs that I've used
MCDM-462||recently the first is Lord Edmund betta gar Lord Edmund betta gar is a 13 year old
MCDM-463||nobleman the players thought the family betta gar had been dead murdered by orcs but the orcs kept one of the family
MCDM-464||alive in case they needed to use him for bargaining purposes so when I created Lord Edmund I thought about two things I
MCDM-465||thought about what is his motivation what is his personality one his motivation is to do his duty he's a
MCDM-466||nobleman he's going to find out when he talks to the heroes that his entire family is dead that he is the last
MCDM-467||member of the family betta gar and also that he is the baron a minute ago he was a 13 year old kid how
MCDM-468||captive by the orcs but now not only is he free he realizes I'm the baron so that's his motivations motivation is
MCDM-469||to do his duty was his personality well he's a nobleman so he's gonna be very haughty imperious not because he's
MCDM-470||trying to be off-putting because that's how he was raised I think he was the first legitimate nobleman my players had
MCDM-471||met and so it was important to me to make sure that they understood that this is a feudal society and there is a
MCDM-472||proper way to treat noblemen here everything else about Lord Edmund fell out of those two things one his
MCDM-473||motivation do my duty to his personality very haughty and noble maybe the most important element of his personality
MCDM-474||came out during playes not something I had written down or anything it was the fact that I realized as I was playing
MCDM-475||him that he's a 13 year old kid but at the same time he's the baron and he is aware of that making your NPCs
MCDM-476||self-aware aware of how they are perceived as a big deal he knows I'm just a kid but he also knows I am the
MCDM-477||Baron so it was important to Lord Edmund that other people treat him like the baron that was a problem he needed to
MCDM-478||solve immediately if they just treated him like a 13 year old kid then they wouldn't give him the respect that he
MCDM-479||needed as a nobleman and the existence of nobleman is largely just a shared illusion there's no physical quality
MCDM-480||that makes a nobleman different than a peasant so when he dealt with the PCs he demanded they treat him like a nobleman
MCDM-481||and they didn't like that by the way they very quickly got sick of this kin he confronted them several times he made
MCDM-482||it an issue and in each case they backed off when he said you will address me as my Lord or sire graves played by my
MCDM-483||friend Phil was like all right Phil said several times I'm really starting to hate this kid but he did it this created
MCDM-484||a lot of interesting tension it was the first opportunity for the players to decide where do we stand on the whole
MCDM-485||feudalism thing whose side are we on when Lord Edmond said you will refer to me as sire or my lord he didn't do it in
MCDM-486||an accent he didn't do with any kind of crazy mannerism he just acted like a nobleman and it put a crisis in front of
MCDM-487||the players would they do that it forced them to think about how do we feel about this how do we feel not just about this
MCDM-488||kid but the idea of there being a bear and a better guard do we care who's in charge well it turned out they did
MCDM-489||because their enemy was Lord Saxton the usurper so even though they didn't like this kid he was the legitimate heir it
MCDM-490||was useful for them to keep him alive that moment where Edmond said you will refer to me as sire or my Lord became a
MCDM-491||kind of microcosm for the entire idea of feudalism the idea of chaos versus law where are the players going to fall on
MCDM-492||that spectrum and the fact that Lord Edmonds attitude was kind of annoying this imperious thirteen-year-old kid got
MCDM-493||their nerves because of the way he insisted they treat him it made it so that it was a real test it would have
MCDM-494||been easy for them to just lock him back up again they talked about that that's one of the things I enjoy doing with
MCDM-495||NPCs is testing the players beliefs sure the Paladin wants to do the right thing but it's kind of hard to do the right
MCDM-496||thing when the NPC who needs help is being a huge helping somebody who is sympathetic is easy helping
MCDM-497||somebody who is not sympathetic is a little bit more difficult and that's dramatic having conceded to Lord Edmonds
MCDM-498||request and treated him like a nobleman which he had insisted on them doing later on he returned the favor and made
