MCDM-709||used that much they just use a six sided die back in the 70s and I think if you got a six there was a random encounter
MCDM-710||so if they're moving through five wilderness hexes I tell the players to roll five times and they get a random
MCDM-711||encounter if they get an 11 or 12 why 11 or 12 on a 12 sided die I don't know I just made it up I think it's because it
MCDM-712||harkens back to that old-school d6 way of doing things and I tell the players if you roll an 11 you're going to be on
MCDM-713||one sharp but if you roll a 12 then you get a harder encounter right rolling higher on the 12 side died rolling a 12
MCDM-714||is more dangerous so I imply that there are two charts for each type of train there is the easy chart and the
MCDM-715||difficult chart and it depends what they roll what chart they get and of course there's a 10 and 12 or a 5 and 6 chance
MCDM-716||that nothing happens now if you know me if you and paying attention you may have
MCDM-717||guessed I have no charts that notion the thing I lied my players I literally say that there is a different chart for an
MCDM-718||eleven versus a twelve but there are no charts I just want them to feel like these things are objective that these
MCDM-719||are the rules of the world that this isn't just something matt has made up so I lie and I say that if they roll an 11
MCDM-720||they get the easy chart if they roll a 12 they get the difficult chart got 1 through 10 nothing happens but the trick
MCDM-721||here is if they get an encounter once they get an encounter then that's it we deal with the encounter and they don't
MCDM-722||have to roll anymore the goal of the random encounter during Overland movement is just to make the world feel
MCDM-723||dangerous it's not to maximize how many bad guys they fight so once they get a random encounter we resolve it and then
MCDM-724||I take it easy on them and I say ok you manage to reach your destination the funny thing though is even though I made
MCDM-725||up the idea that there are two different charts a hard one if they roll a 12 and an easy one if they roll in 11 there
MCDM-726||actually is a tool online which we'll look at in a minute that has easy moderate and difficult charts you can
MCDM-727||roll on and now I use that so first I made it up and then I discovered that there was a tool online that made my
MCDM-728||nonsense seem real that's the great thing about running D&D in this day and age is whatever problem you're trying to
MCDM-729||solve other people lots of other people have tried to solve this problem and someone has probably created a tool to
MCDM-730||make it easy now I say there are two charts one easy and one difficult but even the easy chart is somewhat nasty
MCDM-731||the idea being that a random encounter that happens in the wilderness should be challenging it needs to be challenging
MCDM-732||otherwise it's a waste of time because the players will quickly learn they will conclude rightly that this is the only
MCDM-733||thing they're going to do that day when you're traveling through the wilderness days pass and nothing happens so if they
MCDM-734||encounter a bad guy out here in the middle of the forest the players know this is probably the only bad guy we're
MCDM-735||going to encounter let's use all our resources let's cast all our spells let's use our wild shape let's do
MCDM-736||everything now I have the players role once per hex but I have in the past and I've played with other DMS that have
MCDM-737||them role once period and modify the role by the number of hexes so maybe if you move far enough you guarantee the
MCDM-738||idea that you're going to get an encounter that's down to taste it makes perfect sense to me the idea that you're
MCDM-739||going to roll one die it's less die rolling right but I think players like rolling dice that's one of the reasons I
MCDM-740||have the players roll for the random encounters I could do it behind the screen and a lot of DMS do but I like
MCDM-741||the idea that their fate is in their hands so I tell the players to roll if they're traveling through many hexes
MCDM-742||then that might mean a lot of rolls and maybe for you it makes more sense if they all make one roll
MCDM-743||and then modify it by the number of hexes they're moving through or the number of miles they travel if you don't
MCDM-744||like hexes and in that case I probably wouldn't use the d12 I would probably use percentile dice because I would
MCDM-745||still want to be possible for nothing to happen so you might say there is a 25% chance of you guys getting a random
MCDM-746||encounter maybe it's down to terrain maybe it's 20% into 4 is 25% in the mountains and then modify it by one
MCDM-747||percent or three percent for every hex they move through that would make it unlikely that you'd ever end up in a
MCDM-748||situation where you would be guaranteed to get a random encounter because that would make it not very random but of
MCDM-749||course random encounters are also random because a you don't know if one is going to happen and then B you don't know what
MCDM-750||you're going to fight so there are lots of charts online there's a tool we'll look at in a minute for generating a
MCDM-751||random encounter but I have often pretended to roll on a chart behind the screen but really I'm just looking
MCDM-752||through the monster manual to see what's cool and my idea of what is fun to use in a random encounter is affected by the
MCDM-753||fact that some of the monsters in the monster manual you're probably never going to encounter unless you have
MCDM-754||random encounters out in the wilderness like the players were trying to get from point A to point B in my Thursday night
MCDM-755||game they had a random encounter and I decided to use a wyvern now of course I told them I rolled randomly but I didn't
MCDM-756||I just thought oh we Verne's are cool when was the last time I used one I may never use one let's use one tonight and
MCDM-757||it was a lot of fun actually it was the first time the players had had any kind of random encounter out in the
MCDM-758||wilderness and they learned a lot for instance when they found out when they decided to make camp that night they
MCDM-759||found out that side the elven Ranger he's an elf he doesn't need to sleep he just meditates and they were like well
MCDM-760||does that mean we don't need to take watch and they're like yeah I don't think that mean I think that the elf can
MCDM-761||basically watch for us cuz half the night he doesn't need to sleep and the other half he's just sitting there
MCDM-762||meditating so let's all just go to that which meant when the wyvern attacked only Sai was awake he was the only one
MCDM-763||in his armor everyone else was asleep and unarmored and that's when they found out it takes like 10 minutes to put your
MCDM-764||armor on I didn't give them any advice in this regard I let them play the way they wanted to they were very low level
MCDM-765||characters and this was how they learned to set watch because once you've said watches you have characters that begin
MCDM-766||battle in their armor super useful I had a lot of fun with that encounter watching the players scramble around
MCDM-767||trying to deal with the fact that only one of them had any armor on and a wyvern is an incredibly nasty thing to
MCDM-768||throw up against a low level party but I reasoned thusly wise yes it is a powerful bad guy and it may indeed very
MCDM-769||badly wound one of the heroes I made sure it didn't kill anybody but once the heroes had
MCDM-770||done enough damaged it I had it fly away because it's a wild animal it's out looking for food it sees some
MCDM-771||defenseless humans it decides to try to eat them once they put up enough of a fight I haven't leaved
MCDM-772||so this is one of the kind of interesting side effects of using a high-level monster as part of a random
MCDM-773||encounter if it attacks the heroes while they've made camp and are just spending the night then once it's taken enough
MCDM-774||damage it's going to run away I still award full experience in a situation like that because the players dealt with
MCDM-775||the random encounter but if the players come across the monster in its lair while they're traveling from point A to
MCDM-776||point B then the players have all the power the players are in a position to opt in to decide whether or not to go
MCDM-777||after this monster it's a very tough monster because that's the nature of a random encounter but it's with its
MCDM-778||treasure it's in its lair the players get a greater reward if they beat it and because the players have come upon the
MCDM-779||monster in its lair they have the advantage they have the opportunity to get all the information they want and
MCDM-780||they have the element of surprise it's time to put on your makeup and then missing a huge opportunity here because
MCDM-781||we all know one of the main elements of attack is the element of surprise so what could be more surprising than
MCDM-782||the first Battalion transvestite burgade so that's how I handle encounters in Overland movement the players in my
MCDM-783||campaign in one group their fourth level in another group their sixth level and I think the sixth level party is basically
MCDM-784||done with random encounters in the Overland they have their own method for getting from point A to point B that
MCDM-785||means they don't have to go through the forest they don't have to roll dice for every X and they're now high enough
MCDM-786||level that other stuff is going to start trying to avoid them this process of the player is kind of outgrowing random
MCDM-787||encounters also helps them feel like they've accomplished something like they've grown and developed as heroes
MCDM-788||the kind of stuff that used to really challenge them when they were first second third level now doesn't even
MCDM-789||happen anymore it's another thing that happens when you play D&D for a while you get a high
MCDM-790||level character you start missing that earlier kind of play where being low level you worried about just getting
MCDM-791||from point A to point B on the one hand it's an accomplishment when you don't have to worry about it anymore on the
MCDM-792||other hand it's a fun sense of accomplishment when you actually do it when you actually make it from point A
MCDM-793||to point B and deal with the random encounter using these creatures like with runes and we'll the wisps in their
MCDM-794||native environment and the wilderness makes the world feel richer and more plausible because the types of creatures
MCDM-795||the players encounter are widened not only are there creatures down here where this is their native environment and
MCDM-796||you're just moving through their home and that's why they're attacking you they're hungry they're looking for food
MCDM-797||the game also includes guys up here crazy things like B holders and mind flayers a game that has a wide variety
MCDM-798||of different bad guys to fight in different environments I think is a game that feels more plausible and more
MCDM-799||grounded which is again down to your style of play in the dungeon or whatever kind of underground complex they were
MCDM-800||dealing with or above-ground it could be a castle or a temple but anytime the players are trying to clear out a lot of
MCDM-801||rooms that are full of bad guys a place that has multiple levels the players are going to very quickly decide that they
MCDM-802||want to rest because they want to minimize risk now this is a very different experience than the overland
MCDM-803||movement thing or they're just trying to get from point A to point B here they're in a dungeon they're fighting for their
MCDM-804||lives they're questing after some bad guy they're trying to stop or some treasure they're trying to acquire and
MCDM-805||especially if you have new players after the first encounter they might say well I just took a lot of damage or I'm out
MCDM-806||of spells let's stop not let's rest for an hour let's spend the night and if they do
MCDM-807||that then it kind of removes the tension from the game so it's your job as the dungeon master to put the tension back
MCDM-808||in and that's one of the things random encounters are great for and I think sometimes just the threat of
MCDM-809||a random encounter is enough to keep the players going but again you want the random encounters in the dungeon to be
MCDM-810||nastier than the normal things they would be dealing with otherwise they'll just opt for the random encounter if the
MCDM-811||random encounters are skeletons but the stuff they're fighting in the dungeon is ghouls and whites then of course the
MCDM-812||players will stop and rest because they'd rather fight skeletons in the random encounter than ghouls and whites
MCDM-813||while they explore so that's another piece of advice whatever you're dealing with in the adventure the random
MCDM-814||encounter should be nastier because it disincentivizes the players from stopping and the way I do it is if they
MCDM-815||take a short rest they roll once if they take a long rest they roll twice once for each watch now that doesn't make any
MCDM-816||literal sense and my players always say wait a minute if it's one check for a short rest on a short rest as an hour
MCDM-817||shouldn't that mean eight checks for a long rest because a long rest is eight hours and indeed you could do that if
MCDM-818||you want but I think eight checks is pretty unforgiving so I say no it's it's once per watch as Dungeon Master's it's
MCDM-819||up to us to control the pacing of the game just because it's one check for one hour during a short rest doesn't mean
MCDM-820||it's eight checks for a long rest that's eight hours that would be pretty tedious and that's why I like tying into watches
MCDM-821||I say there are two watches who's on first watch who's on second watch and I have each watch roll random
MCDM-822||encounters on the dungeon also incentivized the players to look at the dungeon
MCDM-823||more like a battlefield more like this is a thing they are exploring this is a thing they're moving through when they
MCDM-824||clear out one room they think to themselves this is a easily defensible place we should remember this for when
MCDM-825||we have to sleep we'll come back here and we'll borrow the door or one of the things that players ask about is on the
MCDM-826||list of things they can buy our Pitons they're like one of these things I'm like well there's a little metal spikes
MCDM-827||that you can hammer into a rock cliff face if you need to climb but they're all so easily used as spikes that you
MCDM-828||hammer under the door between the gap that's where the door on the floor to hammer a door shut if the bad guys find
MCDM-829||them in the middle of the night the fact that the door has been spiked shut means the players are going to get a couple of
MCDM-830||rounds where they can get ready prepare spells wake their sleeping allies up put on their armor before the bad guys
MCDM-831||inevitably burst through the door and there's a lot of tension there as the bad guys start attacking the door the
MCDM-832||heroes can see the door is starting to break and splinter under the assault now of course if your players have a long
MCDM-833||adventuring day and you feel as though a random encounter is too nasty for them then you roll behind the screen don't
MCDM-834||have them roll and take it easy on them roll 1 or 2 or just you know roll a d4 and ignore it
MCDM-835||random encounters are purely a tool that you can use to make the world feel more dangerous more threatening which in some
MCDM-836||ways makes it feel more plausible and control the pacing of the adventure the pacing of the game and kind of
MCDM-837||disincentivize your players from playing in the most risk-averse way possible I found a great tool for generating random
MCDM-838||encounters that I have actually used in the middle of my campaign I just looked for andum Leon line and found and I
MCDM-839||really liked it there's a link to it in the doobly-do you may have found your own random encounter resources online or
MCDM-840||you made your own in which case please link to them in the comments the more the merrier let's take a look at how
MCDM-841||this random encounter generator works and how I use ok this is the tool that I have found to use online for generating
MCDM-842||random encounters I feel it's pretty straightforward easy to use and I told my players when they roll an 11 they get
MCDM-843||the easy chart when they roll a 12 they roll the hard chart so I use hard or deadly here this tool lets pick hard and
MCDM-844||let's imagine that we were using this for the Thursday night group which is six fourth level players so I'm just
MCDM-845||going to go level four add player that's one two three four five six and they are moving through let's imagine they're
MCDM-846||moving through the hills it's going to do its best to try to pick monsters based on the environment that I've
MCDM-847||chosen minimum number of monster and chances we can do single types so they fight one type of something like lots of
MCDM-848||bugs or mixed types I think mixed types is cool I own the monster manual I don't just
MCDM-849||own the basic rules so we choose the monster manual you can pick a seed monster and it will do its best to say
MCDM-850||well an adult black dragon and what else what hangs out with an adult black dragon but here I'll say no seed
MCDM-851||monsters 15 seems like a lot so let's reduce the max number of monsters to 6 and generate a random encounter in suit
MCDM-852||we get four six fourth level heroes out in the Hills right oh they fight a stone golem okay that is super cool but I
MCDM-853||don't know what a stone golem is doing I mean a golem out in the middle of the but but that question why is there a
MCDM-854||Gollum Gollum is an automat on it's a construct it only follows orders it must have a master golem must have a master
MCDM-855||so there's probably a wizard or something or maybe the golem has escaped from some dungeon that's nearby and that
MCDM-856||to me is super cool although you could just take this remember there's no virtue in using the output of this as is
MCDM-857||it's not like the this tool has any great insight if you look at stone golem and go no that's too crazy what about a
MCDM-858||stone giant right stone giant stone golem don't have anything in common but the one reminded you of the other and
MCDM-859||you felt like the stones it was cool so why not use it let's see what I get if I generate another
MCDM-860||encounter cool a bunch of ores there are two orc eyes of Grunch there's an o raagh which is a kind of work two of
MCDM-861||them and there's one regular work and you might change it up you might say no I think there's three orcs one or AAG
MCDM-862||and one eye of Grunch there's no there's no reason to exactly use the numbers they've given you this is just a tool to
MCDM-863||inspire you let's see what happened I mean these are pretty cool encounters actually I like these four berserkers uh
MCDM-864||what does the berserker I think it's in the appendix to the Monster Manual what else might we get for Griffins I think a
MCDM-865||bunch of Griffin's like a patrol like a like a flock of Griffin's would be a great idea for a random
MCDM-866||encounter let's change it to underground right so now we're in a dungeon and let's click deadly the players rolled a
MCDM-867||12 on their 12 sided die what do they get this is going to be crazy let's see we get to psych off C's that reminds me
MCDM-868||of my favorite joke which is from Yellow Submarine hey there's a cyclops um but he's got two eyes or must be a bicycle
MCDM-869||ops it's a bicycle ops I love that so two Cyclops is in a dungeon that sort of makes sense although I might just go
MCDM-870||cyclopses or things I expect to find in the hills of the mountains let's try again ooh three black puddings let me
MCDM-871||tell you one black pudding is enough three black puddings is crazy but it's up to you how many black puddings to use
MCDM-872||black pudding is definitely something I would expect to find in a dungeon and it makes a great random encounter because
MCDM-873||it can get under the door so it because that's it's an it's just it's just a fungus on the ground so the players even
MCDM-874||if they've spiked the door shut the black pudding can still attack them I love that idea let's see what else might
MCDM-875||we get a bunch of orcs and a Manticore they keep these orcs and their Warchief keep this Manticore as a pet again why
MCDM-876||are there orcs in the dungeon isn't an orcish dungeon maybe if not if i feel as though i don't
MCDM-877||know that there were orcs down here I just clicked generate encounter again and I get a vampire that is a heart that
MCDM-878||is a deadly encounter that is definitely a deadly encounter what is the vampire doing down here well one of the things
MCDM-879||now I might just dismiss that or I might actually use it because one of the things I like about old-school
MCDM-880||adventures is that for instance I believe in against the cult of the reptile god the bad guy explicit to
MCDM-881||codify Ellis is in her lair she's asleep on a pile of coins but you might encounter her Elle
MCDM-882||we're in the dungeon she doesn't just stay in one place she goes on Patrol she visits her minions she gives them orders
MCDM-883||right she needs food so you might encounter the bad guy of this adventure not in his lair not in the final room
MCDM-884||not in the last room of the adventure and it might give the players an opportunity to encounter this bad guy
MCDM-885||fight them and then the bad guy retreats or the players retreat and now they have some information about who the bad guy
MCDM-886||is and how the bad guy operates I think that stuff is cool let's do one more I love random encounters this is fun
MCDM-887||this tool is neat is fun to use and it is also a great opportunity to be inspired as a dungeon master you don't
MCDM-888||have to use a vampire you could use a Janos Fink's our guy knows thinks it's a girl's Fink's Andros Fink's and guy
MCDM-889||knows Fink's and I think that you know what is one of these things doing wandering around they used to call
MCDM-890||wandering monsters I don't know let's see what else a flames call three flames calls that sounds cool a bunch of undead
MCDM-891||patrolling I think that's a cool idea especially in a dungeon the idea that there's a bunch of undead patrolling
MCDM-892||around so that's the random encounter episode I'll put a link to the tool in the doobly-doo it's up to you whether or
MCDM-893||not use random encounters and how you use them I hope you can see that I use them kind of I have a system but my
MCDM-894||system is kind of ad-hoc thanks for watching I hope that was useful I think random encounters are a great tool for
MCDM-895||new DMS to use we've been doing a lot of world-building and twitch on the weekends on Sunday at 11 o'clock we'll
MCDM-896||do another stream this coming up Sunday at 11 a.m. Pacific Standard Time for this world building we've been doing in
MCDM-897||twitch I've been using hex OGG refer which I really like I enjoy using hex OGG refer because I like those
MCDM-898||old-school kind of maps I've done maps by hand I've done maps in campaign cartographer but for this campaign for
MCDM-899||this setting that I'm running right now I like that old-school feel and hex ographers a lot of fun to use it can
MCDM-900||generate like a random world and it does its best to kind of figure out where mountain ranges would go and where
MCDM-901||forests should be it's not literally just random terrain everywhere so in the spirit of the twitch building a world
MCDM-902||stream and because I like the software and because I actually like contests and giving stuff away I am going to give
MCDM-903||away a free copy you'll get serial numbers for every product that company inkwell ideas makes they make hex Agra
MCDM-904||fur they make dungeon Agra fur which we talked about earlier they makes it iographer so you can make cities and
MCDM-905||they have a great heraldry tool if you want to create your own heraldry so we just hit 14,000 subscribers a couple
MCDM-906||days ago let's do the giveaway when we hit 17,000 subscribers and it's going to work the way it worked when we gave away
MCDM-907||the meteoric iron day 20 or one who comments below is entered to win and once we hit 17,000 subscribers I'm
MCDM-908||going to randomly draw someone the winner gets a copy of hex Agra fir dungeon Agra fir and Sid iographer and
MCDM-909||their heraldry tool so you can make coats of arms for your world and that's about a hundred bucks actually you know
MCDM-910||the last giveaway was a die that was worth two hundred bucks so let's give away two copies of each of those pieces
MCDM-911||of software we'll have two winners I'll draw two names from the entries down below everybody who comments is entered
MCDM-912||once we hit 17,000 subscribers I'll pick two people and each of them will get one copy of each of those pieces of software
MCDM-913||so the faster we get to 17,000 subscribers the fewer comments there will be in the more likely it is that
MCDM-914||you'll win so feel free to share this channel share this video share some other video share the alignment video
MCDM-915||share the your first adventure video it's up to you I'm a big believer in social media I love it I'm on Twitter
MCDM-916||all the time I'm on reddit you can follow me on Twitter at Matt Colville I'm also Matt Koval on twitch that was
MCDM-917||the random encounters episode I hope it was useful as always there are no ads on this channel I don't have a patreon if
MCDM-918||you want to help support the channel come by my amazon page there's a link in the doobly-doo I'm an independent
