MCDM-0||his body is disintegrating he is not of this world and the strain of being here is killing him he is not like us he is
MCDM-1||not one of us he can do amazing things he has one chance to return to his people if he can make it to the
MCDM-2||rendezvous coordinates at the appointed time he will live he will leave us and return to the world he belongs him if he
MCDM-3||fails he dies there are humans who care about him aid him but there are other humans chasing him they want to use him
MCDM-4||or study him he doesn't want to dissect the visitor he just wants to understand and when he does understand he will help
MCDM-5||that's the plot of three different movies each one about a different alien about the humans who help the alien and
MCDM-6||the humans chasing an alien of the three films that follow this plot the pivotal one is John Carpenter's 1984 forgotten
MCDM-7||masterpiece Starman carpenter delivered his first masterpiece two years earlier in 1982 the chilling intensely watchable
MCDM-8||the thing it remains one of my favorite movies the thing opened a few weeks after the first movie to use this plot
MCDM-9||Steven Spielberg's et and et crushed the thing it crushed a lot of movies that summer all of which are more often
MCDM-10||watched and talked about now it crushed Blade Runner filmmakers in the early 80s hoped to use the new explosion in
MCDM-11||science fiction to tell challenging stories but really what everyone wanted was to spend two hours with a cute alien
MCDM-12||the thing was John Carpenter's attempt to make a Howard Hawks movie make a taut masculine action thriller and for my
MCDM-13||money he got as close as you can get without being Howard Hawks people talk about the thing as a masterpiece of
MCDM-14||horror but really I think it's just a brilliant movie forget the genre if the thing had been a hit I think John
MCDM-15||Carpenter would have turned into one of our greatest directors but it wasn't a hit it cost a lot of money and it tanked
MCDM-16||there's a danger when you fail to make enough money for the studio that you'll never get a second chance and Carpenter
MCDM-17||knew it so when he got a second chance he didn't waste it he hit another home run just a show he could do it he said
MCDM-18||oh you want nice aliens fine and delivered Starman a better movie than ET in every way except there's a scene in
MCDM-19||ET where they play Dungeons & Dragons that's cool Carpenter described Starman as his apology to Hollywood for the
MCDM-20||thing I'm sorry I scared the out of you please let me keep making movies alas it
MCDM-21||was too late Starman came in number 30 at the box office that here and carpenter never got a third chance
MCDM-22||to be a major director in Hollywood thanks et et is whether he likes it or not the progenitor of the plotline from
MCDM-23||Jeff Nichols as new film Midnight Special same story the only innovation here is
MCDM-24||making the kid from et the alien but Nicholas didn't want to make et he wanted to make star man he talks about
MCDM-25||it in interviews Nichols said he wanted to make a 1980s John Carpenter movie as though 1980s John Carpenter is a genre
MCDM-26||all its own which maybe it is he said he thought star man was a good place to start he started there but having
MCDM-27||watched midnight special he doesn't seem to have gone anywhere with it star man is in always a more interesting
MCDM-28||rewarding movie Midnight Special raises all the same questions a star man and has just as many answers they're just
MCDM-29||not as interesting in fact they're baffling in their lack of imagination midnight special opens on a black screen
MCDM-30||a radio playing and what we learn is a motel room before we see anything we hear a commercial for a Fort Worth
MCDM-31||Nissan dealership so we know we're in Texas visit WWE em so we know it's the modern day but it doesn't look like the
MCDM-32||modern day everyone in this film the way they dress the cars they drive look like the 1970s just kept going given that
MCDM-33||he's basically remaking a movie set 35 years ago maybe that's nickels his point he likes
MCDM-34||stuff from back then so he made his movie looked like something from back then the film looks great like Starman
MCDM-35||Midnight Special spends all its time on the highways and gas stations and back roads of the American South this is
MCDM-36||Nicholas's territory and he makes it look amazing it's beautiful it's just kind of boring with the possible
MCDM-37||exception of atom drivers character and no one in this movie talks or behaves like a normal person we spend the entire
MCDM-38||movie with a young boy Alton and his parents but no one ever says I love you no one has a nickname for Alton no one
MCDM-39||ever calls him champ or a sport or snicklefritz everyone so in awe of him including his parents who should
MCDM-40||remember a time when their kid was more normal before we could hear and decode encrypted radio broadcasts and other
MCDM-41||languages but they all treat him as though there was never time when he was just their son they act like he was
MCDM-42||always an alien it seems like there was never a point when their lives were normal it would have been nice to see a
MCDM-43||hint of a time before the movie started I love the sentiment his father expresses when Alton says you don't have
MCDM-44||to worry about me Michael Shannon says I'll always worry about you that's the deal he never says he loves his son
MCDM-45||but he says he'll always worry about him I like worrying about you he says baby that's nickels this point love means
MCDM-46||spending your life worrying about someone Michael Shannon is amazing to watch act but apart from the look
MCDM-47||worried and desperate he hasn't given anything else to do every scene he's in it is the same you can mix them up watch
MCDM-48||them in any order still make sense I wanted an ark some humanity something they've got Sam Shepard in this movie
MCDM-49||who was a brilliant actor and writer and we see him for like two minutes and that's it
MCDM-50||crazy to waste him like that Adam drivers amused detached curiosity is fun to watch and gosh I wish we'd gotten
MCDM-51||more that now I think I would have liked the movie more if the whole thing had been from his point of view
MCDM-52||probably the narrative wouldn't sustain that too much of a good thing but unlike everyone else in the movie every time he
MCDM-53||is on screen I was happy and entertained and keen to see what happened next he has more in common with Alton than
MCDM-54||anyone else in the picture he finds everyone even the government he works for amusing and they're clueless
MCDM-55||sincerity and earnestness I was intensely interested in Midnight Special when I first heard about it I haven't
MCDM-56||seen Nichols as other work I didn't really know what to expect but the previews completely hooked me and I've
MCDM-57||spent the last two months spreading the gospel I spent two and a half hours in traffic to see it in LA this weekend I
MCDM-58||wanted to believe but I don't think there was much to believe in Starr man has an arc the title character has an
MCDM-59||arc the woman he kidnaps has an arc Jeff Bridges is playing a complex character with a lot going on into the surface
MCDM-60||Karen Allen is playing a complex character with a lot going on under the surface they are each going through the
MCDM-61||same experience but from opposite directions and that makes it interesting every time Jeff Bridges as alien talks
MCDM-62||does anything we learn something amazing we see something amazing the plot advances his mystery expands and
MCDM-63||tantalizes and moves us it's a remarkably fer tiles to crypt each sequence shows us something new and
MCDM-64||unexpected midnight special is basically the same scene repeated for two hours we never really learned anything about
MCDM-65||Alton he does some amazing stuff often using the same special effects with star man but it doesn't move the plot forward
MCDM-66||or teach us anything about his character when the alien in star man finally meets the government scientist who's been
MCDM-67||curious about him the whole time we get an amazing scene it's sentimental and obvious but sometimes that's what a
MCDM-68||movie demands that same scene in Midnight Special has nothing no information no pathos in star man we
MCDM-69||learn something about the aliens and we learn some about ourselves and midnight special we
MCDM-70||just get a white room and a kid who can do tricks when Alton finally tells us what the
MCDM-71||hell is going on it's baffling I don't mean incomprehensible I mean I was baffled this was their answer I don't
MCDM-72||belong here he says yeah we guessed that but and this is important no explanation is given as to why like he is apparently
MCDM-73||Kirsten Dunst and Michael Shannon's biological kid but he's also an alien from another world what there's a
MCDM-74||profound lack of thought put into the explanation for why everything happens in this movie and I got the sense it was
MCDM-75||meant to be more mystical than science fictional but regardless of whether it's science or fantasy the ending needs to
MCDM-76||pay off the rest of the film star man has a great explanation for everything that's happening everything in star man
MCDM-77||makes a logical sense from the opening premise that mankind has been sending messages to aliens which is true by the
MCDM-78||way we have we really made a spaceship and sent it out of the solar system with a message from Earth on it inviting any
MCDM-79||aliens who find it to come visit us I'm not making that up it's real and everything in star man logically follows
MCDM-80||from it nothing in midnight special makes any sense and when we finally get the closing reveal showing us Alton's
MCDM-81||world it's it's pretty disappointing this is apparently the revelatory religious experience everyone's been
MCDM-82||having when they look in Alton's eyes and the only thing I can conclude is they don't have concept artists in Texas
MCDM-83||or Louisiana like go buy an art book guys go look at a yes album cover from the 1970s Google Sid meat or fangs ooh
MCDM-84||come on I felt the pressure Starman exerted on this film jeff nichols said he wanted to make a movie
MCDM-85||like Star Man but he clearly didn't feel he could just remake that film he didn't feel he could just lift that plot he
MCDM-86||needed to make his own version but his versions explanation for everything is so weak as to completely deflate all
MCDM-87||attention leading up to it when your whole movie is the mystery the mystery needs to be damn good if you've got
MCDM-88||great characters and dialogue and we just love spending time with these people
MCDM-89||then we won't notice much if the destination isn't that interesting but if the journey is flat and monotonous
MCDM-90||you really need a hell of a destination to make it all worthwhile and midnight special acts that star man had great
MCDM-91||characters quotable dialogue great journey great destination Midnight Special doesn't great actors movie looks
MCDM-92||beautiful otherwise there's a scene at the end the last shot in fact I'm not going to spoil it
MCDM-93||that's meant to send us out of the theater wondering leave us with a question but after the events in
MCDM-94||Midnight Special I'm not particularly interested in engaging with that question the movie
MCDM-95||didn't give me any reason to believe there might be an interesting answer there it just made me want to go watch
MCDM-96||star man again maybe et that's why I thought of midnight special let me know what you
MCDM-97||thought if you liked this I'll probably do more reviews in the future movie reviews is something I've been doing
MCDM-98||your semi regularly for the last 20 years on that website and now I've got a camera and I set up here and I thought
MCDM-99||I'd make a video if you liked it I'll make more if you didn't like it I'll probably still make more but I will be
MCDM-100||less excited about it until next time peace out 
MCDM-101||Hi everybody, my name is Matt Colville, and as you can see I am a white, middle-class, middle-aged nerd. And if you guessed, "I bet that guy plays D&D,"  you would be correct. This is my channel and it's about running Dungeons & Dragons.
MCDM-102||Here's the pitch: I want to turn you from someone who wants to play D&D into somebody who wants to run D&D. Being a Dungeon Master is fun! It's creative and it's not that hard. But if you don't know how it's done, it seems intimidating. Maybe you've seen Critical Roll.
MCDM-103||*shouts* Or Acquisitions Incorporated "And a Beholder comes through."
MCDM-104||"What!?" "A real one?" "I've got a way bigger one"
MCDM-105||And thought: 'Wow that seems awesome!' But those guys are amazing I could never do that. Well that's nonsense first of all Matt Mercer and Chris Perkins have been running the game for like a million years.
MCDM-106||Do not compare yourself to them. They are craftsman who have honed their art to a fine edge over literally decades. When you start off, you'll be terrible.
MCDM-107||I realise that's not the most encouraging thing to say but the fact is your players will be new and they won't know you're terrible. That's the secret.
MCDM-108||If you play with your friends and none of you have ever played before they will think you are amazing the way everyone thinks Matt and Chris are amazing. And after a while, you will be a great DM.
MCDM-109||And the thing is, it will be fun the entire time. It'll be fun while you're terrible at it, and it'll be fun while you're great at it. So if you're interested in 'running', I'm here to de-mystify it and show you it's easy and awesome.
MCDM-110||Why would I go through the trouble of making a YouTube series just to teach you how to be a good DM? Because I am a river to my people. "The Turks pay me a golden treasure yet I am poor."
MCDM-111||"Because I am a river to my people!" *people shouting and cheering* 
MCDM-112||You are going to run D&D, tonight, for free, with an adventure that you made. -Well, we made -Ok, I made. The principle is the same. What do you need to get started? You need three things: you need some friends, you need the rules, and you need an adventure.
MCDM-113||Friends: I recommend between 3 and 4, you can run for more, I've run for as many as 9, 10, I think 11 I did once,  it was a nightmare, I do not recommend it. You need the rules: you may be tempted to get the three core rulebooks, the Player's Handbook, the Monster Manual, and the Dungeon Master's Guide, but that's a lot of money to spend for your first time out
MCDM-114||And you'll feel like "I have to read all 3 of these books in order to know  what's going on." That is not true. Wizards of the Coast put the basic rules online for free, the contain everything you need and a simple explanation for how everything works. I put a link to the free rules in the blah-blah down below.
MCDM-115||There's also a link down there to a whole bunch of pre-generated characters, which will make you life a lot easier. They're also official, they're from Wizards of the Coast, you print out a whole bunch of them and you put them in front of your friends and let them pick they characters they want to play. Later on, when your friends are hooked and they love playing, you can let them make their own characters, they'll have a lot of fun doing it.
MCDM-116||But making characters in D&D is- -it's something that's fun to do if you already know how to do it, it is not fun to learn, and it's kind of a pain in the butt. We'll go over how to make characters later on, especially from the DM's point of view in another episode.
MCDM-117||So you need some friends (I said between 3 and 4), you need some rules (you can download those for free online), you're also going to get some pre-generated characters for free (that's also in the blah-blah down there), and you need an adventure. We're going to do that right now.
MCDM-118||Back in the 1970s, when the game first came out, the guys who created the game had their own adventures, but they did not include them in the game, because they thought part of the fun was you making your own, so that's what we're gonna do. You can download lots of adventures for free online, and in fact, there are some great classics you can get at dndclassics.com that're still playable.
MCDM-119||You can go out and get the D&D Starter Set, which I think is twenty or thirty bucks and includes this thing, The Lost Mine of Flapdoodle (Flapdoodle? Phandelver. Whatever.) Not the best name in the world, but this adventure is like fifty pages long, and it would take you about 3, 4, maybe 6 weeks to finish this. I think for your first time, it's best to run something that you can finish in one night and that means 3 or 4 hours of play.
MCDM-120||I think in general, players only get through about 5 encounters in one evening, so our adventure is going to have five encounters. Alright, so, what's an encounter? An encounter is anything  that stops the player's forward progress and challenges them. The classic encounter is: a battle. You open the door, and see 5 goblins, roll initiative.
MCDM-121||That's an encounter. But traps are also an encounter, remember Indiana Jones and the Golden Idol? Or the holy grail?
MCDM-122||- kneal! Those are both traps. Puzzles are encounters. Remember Gandalf at the gates of Moria?
MCDM-123||Frodo: What's the elvish word for "Friend?" Gandalf: Mellon That's a classic puzzle.
MCDM-124||Since the classic encounter is a battle, and you're players are going to be first level, we're going to start with goblins. Goblins are easy to run, and they're pretty flexible, meaning: if your players end up walking through it,  and it's too easy, you can always just throw more goblins in, and adding one or two more goblins to an encounter is not the end of the world.
MCDM-125||So our encounters will be fighting some goblins, fighting some more goblins, fighting the boss of the goblins, there'll be a trap in there, and there'll be a puzzle in there, that's five encounters, that's about one evening's worth of adventure, 3 to 4 hours. Since it's in the name of the game, our adventure is gonna be a dungeon, and therefore, we're gonna need a map  of the dungeon.
MCDM-126||Later on you'll have lots of maps. You'll have maps of the world, you'll have maps of the local area, you'll have maps of the town, you'll have maps of the tavern in the town, But for right now, we just need a map of the dungeon. And the easiest way to draw a map is usually just with a pencil and an eraser (you can tell I'm hardcore because I have this cool art eraser),
MCDM-127||And some graph paper, but since watching me draw something on graph paper is not exactly the most exciting thing in the world, we're going to use a program that is free, you can use online, called Dungeonographer. There is a payed version of Dungeonographer, and I recommend you  get it if you like it, if you find it easy and fun to do.
MCDM-128||There is a link to Dungeonographer down in the blah-blah, so if you want, you can try yourself, you can make your own dungeon. I've also included my Dungeonographer file so you can load it in and you can move things around if you want. Remember, this is your dungeon, customize it, make it yours.
MCDM-129||Woah, transition! Ok, this is Dungeonographer, we're going to create a map of our first adventure, and for our first dungeon we don't necessarily need the sexiest dungeon in the world,
MCDM-130||instead we want to make something that's actually pretty simple and straightforward so it doesn't seem intimidating, and seems like it would be easy to run, I assure you, you and your players will still have fun running it. So, I'm imagining this is a tomb of an order of knights, and that the goblins have broken in and taken it over.
MCDM-131||So we're going to start with an entrance, uh, the entrance to the tomb, we'll put a doorway there in a little while. And, uh, we imagine that there'll be a couple of goblin guards at the top of the entrance, uh, so the players have somebody to interact with, uh, and maybe the players will ambush them. And we'll put some stairs down here, you can tell they're stairs down because the wide lines are at the top and the tiny narrow lines are at the bottom.
MCDM-132||Now we want to put something interesting down here for the players to interact with. So, we drop a trap down there. That's that litte square with a T on it.
MCDM-133||And the idea here is that it's a pressure-plate trap The players have just maybe fought the goblin guards, they're sneaking into the dungeon. and if they're not paying attention, they'll step on the trap and trigger a scythe that comes out of the ceiling.
MCDM-134||A giant blade that will slice them up. Like the trap from the Indiana Jones movie, why not? And now we move on to our next room.
MCDM-135||And here, this is a larger room, this is probably where the goblins are sleeping, or hanging out, or making their goblin nest. And we're going to put in this room kind of the history of the order of knights on the walls.
MCDM-136||There'll be carvings on the walls showing the knights fighting Chaos or Evil. You know, maybe even goblins. And we'll put a little brazier there, a little copper bowl,
MCDM-137||that people in times past have, when they come to the tomb of knights to kind of, like you know, put flowers on their grave, they would make an offering in the copper bowl.
MCDM-138||But this is where the goblins will be hanging out. Now we need a room for our boss monster fight and the players will be encouraged to think that this is the last room of the dungeon.
MCDM-139||The room will be dominated by a giant stone statue of the leader of the order of knights, whose tomb this is. So, the players should be impressed by how awesome this guy was in life. So, we grab a statue icon, that's the little five-pointed star there.
MCDM-140||We'll drop it in and we'll put him on a dais. A little raised off the top of the ground, on a stone platform. And we'll drop the platform in. And now, the way dungeonographer works, I'll have to click on that platform.
MCDM-141||Since I put it in there second it's on top and if I click the "send to back" icon it will cause the, uh, statue icon to pop forward.
MCDM-142||So, we're going to put a bugbear boss in here, leading the goblins, and he'll have a couple of goblin buddies. And there'll be a cool fight in here, and the players may think "That's it!"
MCDM-143||But that's not going to be it, we're going to have something secret in here. Remember we like the idea that there's something hidden.
MCDM-144||And we'll put another room in here where the knights are actually buried. And the players should be wondering, like, "Hey, if this is a tomb, where are the knights' sarcophagi?" Well, there in here.
MCDM-145||And we'll drop, like, a large sarcophagus up at the top for the leader of the order of knights. And then we'll put a few smaller ones in here. So, these are the other knights of the order.
MCDM-146||And because this room is meant to be hidden and something the players have to look for to find, we're going to put a little secret door there, which is the S symbol. And now we've got a pretty cool little dungeon.
MCDM-147||Who are the players going to fight if they come in here? Well, if the start interfering with the tomb, with the sarcophagi,
MCDM-148||uh, some undead guys will pop out. So, it's not going to be just goblins, we'll throw some cool undead in there. So this is our map, and we're gonna export it and we'll
MCDM-149||do a cool little non-repro blue, uh, printout so it looks like the old classic - I happen to like the old, the look of the old classic adventures, and now we'll start labelling our map, we have our entranceway
MCDM-150||which will have our goblin, uh, lookouts, we have our trap, and we'll make it so that that trap, uh, the pressure plate trap is something that if you're light enough, if you're a goblin, for instance, or a halfling,
MCDM-151||you don't trip the trap, and that's how the goblins are able to get in and out, without getting 'scythed' to death.
MCDM-152||And we mark everything else, we mark our ending there, And we start writing our notes directly on the map - why not, I'll often do this in pencil - So we have our goblin lookouts, at the front, we have our pressure
MCDM-153||plate trap, where if you're light enough you don't trigger it, and often, the thief in the party is a halfling, so he may be able to pass and he has no idea there's a trap there.
MCDM-154||We have our offering room, with a brazier, which allows uh, normal people to come and make sacrifices and this will be our goblin bivouac, where the goblins live and sleep and have their collective being, And on the walls, are carvings of the knights fighting, so the players are reminded this is
MCDM-155||a tomb of an order of knights. And we're also going to have, written on the wall opposite the knights, the oath that the knights took in order to become members of their order - that's gonna be important
MCDM-156||later, because we also said we wanted a puzzle in here, and that's going to be part of the fun of room number four, not only is there a goblin boss, with his buddies,
MCDM-157||we have a statue of the leader of the order of knights, and I happen to like the idea that it's an ancient, kind of Roman-esque uh, order, and so his name is Sextus Varnus, and there's uh, a riddle,
MCDM-158||printed, uh, on the daius, that the players can read, and if they're smart, they will figure out the riddle and that will cause the door to open, but a thief can open it, and find the hidden room with the undead in,
MCDM-159||are the undead skeletons? Are they ghouls? You know, maybe that's up to you! And, ultimately, we want some cool treasure that the players find,
