MCDM-160||in the sixth room, in the sarcophagus, so they get a cool magic sword. And we want our dungeon to be dynamic, so we create a
MCDM-161||patrol of goblins, that goes all around the mausoleum and out into the forest about every, let's say four hours, and so if the players stay outside, and watch to see what's going on with this mausoleum,
MCDM-162||they'll see the guards outside the front door, but eventually they'll see the goblin patrol, if they're impatient and just go right up to the front door they'll miss the goblin patrol,
MCDM-163||so later, while they're in room three,  fighting the goblins in there, the patrol will find them and come up behind them, and now they're fighting on two fronts.
MCDM-164||and the guys who were in the back of the party who thought they were safe, find themselves in trouble. and that makes it fun, and makes it seem like the goblins are clever and smart, and that's always a good idea.
MCDM-165||And we said we wanted a puzzle, so we'll create a riddle, that'll be inscribed on the pedestal on the statue in room four, this is something I just made up,
MCDM-166||"If you are to keep this, you must first give it to me." And the answer is: your word! If you're going to keep your word to somebody you have to first give them your word.
MCDM-167||"I give you my word." I think an order of knights would really like that. So we're gonna create an oath, that the players, if they speak the oath and give their word to the statue in room four,
MCDM-168||will unlock the secret door. So, what is that oath? We'll create "The Oath of the Delian Order" that's the name of the order of knights,
MCDM-169||And it'll be in room three, on the one wall is the, uh, stone carvings of knights fighting bad guys, and on the other side is the oath.
MCDM-170||"I swear to serve law, battle, chaos, and strive to keep the lore of the Delian Order secret." So the players read this in room three, and wonder what it's about, and if they solve the riddle in room four - even if they don't solve the riddle, they may just speak the oath -
MCDM-171||and the statue will unlock, uh, the secret door, and that's it, they'll get to fight the bad guys, they'll get the magic sword, and that is our first adventure, with a map and everything! Not bad!
MCDM-172||Okay, so we just made our first adventure, except... not really. What we have is a pretty good outline, and a lot of nice detail, we have a map, we have an idea of what's gonna happen in each room,
MCDM-173||But what we're missing for this is the context, we're missing the setup. We wanna know: how did the players find out about this? And why did they go to the tomb in the first place? Also, something else that I realised as I was getting this part of the video ready,
MCDM-174||is that after I'd done everything else, I'd kinda screwed the map up a little bit - I put a trap before the offering room, and the whole idea of the offering room is that this is where people would come, back in the day where the memory of these knight was still recent,
MCDM-175||people would come and make an offering to this order of knights, like, you know, "please bless us and look after us." And it doesn't make a whole lot of sense, to do that, uh, after you get your head cut off by a scythe trap.
MCDM-176||Now, this is entirely typical DM stuff, you'll have an adventure ready, you'll even run and you feel like you understand it, it may be one you created it may be one you downloaded but as you're running it your players start to notice stuff that you hadn't thought of and you're like "oh,
MCDM-177||yeah, that doesn't make any sense, I need to do some fancy footwork here to explain all this." So the next time you run it for the next group of players, you've fixed it, you've tweaked it a little bit, and over time, the adventures that you run - whether they're ones that you've made up yourself or they're ones
MCDM-178||you downloaded or bought, they get better, you get better running them, you make little notes, you remember stuff from last time.
MCDM-179||So what I did was, I just went and rearranged two of the rooms, you can see the map here. and you can see that I just moved the offering room up one square and put
MCDM-180||the trap after. then I rearranged the text so the numbers make sense. And that's exactly the same kind of stuff you're gonna do as a DM.
MCDM-181||So our next episode and the last of this opening series, we're gonna talk about setting up the adventure, explaining it to the players, getting them hooked, giving them a reason to do all this stuff
MCDM-182||and getting into a little bit more detail about how to run it what kind of things are going to happen as you run this adventure? That's it for Episode Two.
MCDM-183||Peace... Out. 
